"ID","Abteilung","Jahr","Aktenzeichen","Status","Titel"
"04-2014-233","04","2014","WD 4 - 233/14","A","Mittelverwendung der Beiträge des Restrukturierungsfonds"
"04-2014-221","04","2014","WD 4 - 221/14","A","Unilaterale Handlungsmöglichkeiten gegen Steuervermeidung - Steuerplanung von Unternehmen im Ausland"
"04-2014-212","04","2014","WD 4 - 212/14","A","Einzelfragen zur Neuordnung der föderalen Finanzbeziehungen"
"04-2014-203","04","2014","WD 4 - 203/14","A","Abschaffung des Ehegattensplittings - Übergang zur Individualbesteuerung"
"04-2014-194","04","2014","WD 4 - 194/14","A","Zur strafrechtlichen Verjährungsfrist bei Steuerhinterziehung sowie zur Vereinbarkeit einer steuerlichen Anlaufhemmung für nicht erklärte ausländische Kapitalerträge mit Unionsrecht"
"04-2014-193","04","2014","WD 4 - 193/14","A","Steuerliche Förderung von Forschung- und Entwicklung in ausgewählten EU-Staaten, Kanada, Japan und USA"
"04-2014-173","04","2014","WD 4 - 173/14","A","Kompetenzübertragung im Rahmen der Bundessteuerverwaltung"
"04-2014-153","04","2014","WD 4 - 153/14","A","Lizenzgebühren und steuerliche Förderung von Forschung und Entwicklung in Europa"
"04-2014-146","04","2014","WD 4 - 146/14","A","Haushaltsrechtliche Aspekte einer Zweckbindung von Kartellstrafen zugunsten des Verbraucherschutzes"
"04-2014-096","04","2014","WD 4 - 096/14","A","Ausgleich der kalten Progression in der Einkommensteuer"
"04-2014-088","04","2014","WD 4 - 088/14","A","Degressive Abschreibung auf angespannten Wohnungsmärkten in Ballungsgebieten"
"04-2014-062","04","2014","WD 4 - 062/14","A","Erlöspools in der Schifffahrt - Steuerliche"
"04-2014-030","04","2014","WD 4 - 030/14","A","Finanzverfassungsrechtliche Fragen zur Zulässigkeit der Erhebung einer Bodenschätzeförderabgabe durch die Länder"
"04-2014-016","04","2014","WD 4 - 016/14","A","Finanz-TÜV und Finanzmarktwächter"
"04-2013-145","04","2013","WD 4 - 145/13","A","Verfassungsrechtliche Fragen zur steuerlichen Freistellung des Existenzminimums für Kinder"
"04-2013-143","04","2013","WD 4 - 143/13","A","Steuer- und finanzverfassungsreclitliche Zulässigkeit der Variante einer Autobahn-Vignette"
"04-2013-126","04","2013","WD 4 - 126/13","AI","Steuerrecht für Abgeordnete"
"04-2013-113","04","2013","WD 4 - 113/13","A","Altschuldentilgungsfonds"
"04-2013-068","04","2013","WD 4 - 068/13","A","Steuerrechtliche Aspekte der Ausflaggung von Handelsschiffen"
"04-2013-017","04","2013","WD 4 - 017/13","A","Finanzverfassungsrechtliche Aspekte der Einführung einer PKW-Maut"
"04-2013-011","04","2013","WD 4 - 011/13","A","Verfassungsgerichtliche Vorgaben für die Vermögensbesteuerung"
"04-2013-002","04","2013","WD 4 - 002/13","A","Kanadas Banken in der Finanzkrise"
"04-2012-280","04","2012","WD 4 - 280/12","A","Fragen zur Rückwirkung von Steuergesetzen"
"04-2012-268","04","2012","WD 4 - 268/12","A","Umlagefinanzierung für den öffentlichen Personennahverkehr (ÖPNV) - Rechtliche Probleme hinsichtlich der Einführung einer ÖPNV-Abgabe für alle Einwohner"
"04-2012-257","04","2012","WD 4 - 257/12","A","Solvency II - Berechnung der Solvenzkapitalanforderungen"
"04-2012-256","04","2012","WD 4 - 256/12","A","Protektor Lebensversicherungs-AG"
"04-2012-244","04","2012","WD 4 - 244/12","A","Fragen zu steuerlichen Problemen bei Unternehmensgründungen in der IT-Wirtschaft - Insbesondere betreffend die §§ 8b, 8c Körperschaftsteuergesetz (KStG)"
"04-2012-242","04","2012","WD 4 - 242/12","A","Situation der Kreditgenossenschaften in Europa"
"04-2012-232","04","2012","WD 4 - 232/12","A","Finanzverfassungsrechtliche Aspekte der Einführung einer sog. City-Maut"
"04-2012-222","04","2012","WD 4 - 222/12","A","Die Reaktion Islands auf die Bankenkrise - Ursachen  für die Krise und Anwendbarkeit der isländischen Maßnahmen auf andere betroffene Staaten"
"04-2012-220","04","2012","WD 4 - 220/12","A","Solvency II - Kritikpunkte aus Unternehmens- und Verbrauchersicht hinsichtlich der Solvency II-Richtlinie"
"04-2012-213","04","2012","WD 4 - 213/12","A","Versorgungsbezüge der Beamten, Berufssoldaten und Altersentschädigungen der Abgeordneten - Bund, Länder und Gemeinden"
"04-2012-212","04","2012","WD 4 - 212/12","A","Rechtliche Bedingungen und Voraussetzungen einer Abgabe für Arbeitgeber zur Finanzierung des öffentlichen Nahverkehrs"
"04-2012-207","04","2012","WD 4 - 207/12","A","Entziehung von Banklizenzen wegen Beihilfe zu Steuerstraftaten"
"04-2012-203","04","2012","WD 4 - 203/12","A","Versagung oder Entzug von Banklizenzen"
"04-2012-200","04","2012","WD 4 - 200/12","A","Europäisierung der Banken- und Finanzaufsicht - Vereinbarkeit mit deutschem Verfassungsrecht"
"04-2012-153","04","2012","WD 4 - 153/12","A","Finanzverfassungsrechtliche Zulässigkeit von Bund-Länder-Anleihen mit gesamtschuldnerischer Haftung"
"04-2012-150","04","2012","WD 4 - 150/12","A","Offshore-Windenergieanlagen und Gewerbesteuer - Gewerbesteuerliche Behandlung und Kritik"
"04-2012-128","04","2012","WD 4 - 128/12","A","Situation der Sparkassen in Europa"
"04-2012-122","04","2012","WD 4 - 122/12","A","Schweiz: Bankgeheimnis und Besteuerung ausgewählter juristischer Personen"
"04-2012-121","04","2012","WD 4 - 121/12","A","Informationsaustausch bei Doppelbesteuerungsabkommen (DBA), Tax Information Exchange Agreements (TIEAs) und im Rahmen der EU-Zinsrichtlinie"
"04-2012-116","04","2012","WD 4 - 116/12","A","Frage zu § 9 Nr. 1 Gewerbesteuergesetz (GewStG) - Kürzung für Grundbesitz bei Grundstücksunternehmen"
"04-2012-115","04","2012","WD 4 - 115/12","A","Bürgerschaftliches Engagement; Zuwendungsrecht; Verwendung Lotteriegelder"
"04-2012-113","04","2012","WD 4 - 113/12","A","Fragen zur Mischfinanzierungen"
"04-2012-104","04","2012","WD 4 - 104/12","A","Finanzierung von Maßnahmen des Verbraucherschutzes durch die Umlage nach § 16 Finanzdienstleistungsaufsichtsgesetz (FinDAG)"
"04-2012-065","04","2012","WD 4 - 065/12","A","Verfassungsrechtliche Grenzen der Finanzierung einer Bundes(ober)behörde durch eine Umlage - Diskussion am Beispiel der Umlage nach § 16 Finanzdienstleistungsgesetz"
"04-2012-057","04","2012","WD 4 - 057/12","A","Verfassungsrechtliche Grenzen einer Vermögensabgabe"
"04-2012-045","04","2012","WD 4 - 045/12","A","Zustimmungspflicht gemäß § 20 b Parteiengesetz der DDR (PartG-DDR)"
"04-2012-026","04","2012","WD 4 - 026/12","A","Rechtliche Aspekte der Einführung einer Sonderabgabe „Maritime Standortsicherung“"
"04-2012-008","04","2012","WD 4 - 008/12","A","Umsatzsteuer bei Onlinedienstleistern"
"04-2011-264","04","2011","WD 4 - 264/11","A","Sonder- und Treuhandvermögen des Bundes"
"04-2011-258","04","2011","WD 4 - 258/11","A","Erhebung von Gewerbesteuern auf Trassenentgelte - Vereinbarkeit mit nationalem Recht und dem Recht der Europäischen Union"
"04-2011-235","04","2011","WD 4 - 235/11","A","Vorschläge zur Zusammenlegung der Gewinneinkunftsarten im Einkommensteuergesetz"
"04-2011-224","04","2011","WD 4 - 224/11","A","Ausgabenteilung bei sich überschneidenden Verwaltungsaufgaben von Bund und Ländern - Prüfung der Zulässigkeit nach Art. 104a Grundgesetz"
"04-2011-215","04","2011","WD 4 - 215/11","A","Fragen zur Energiesteuer/Mineralölsteuer"
"04-2011-210","04","2011","WD 4 - 210/11","A","Vorschläge der Independent Commission on Banking (ICB) zur Reform des britischen Bankensektors"
"04-2011-204","04","2011","WD 4 - 204/11","A","Zum Transfer passiver in aktive Leistungen im Rechtskreis des SGBII"
"04-2011-201","04","2011","WD 4 - 201/11","A","Vorschläge für eine rechtliche Modifikation der Tonnagebesteuerung nach § 5a Einkommensteuergesetz (EStG)"
"04-2011-199","04","2011","WD 4 - 199/11","A","Weiterleitung von Bundesmitteln durch die Länder an die Kommunen bei der Grundsicherung im Alter und bei Erwerbsminderung"
"04-2011-167","04","2011","WD 4 - 167/11","A","Vergleich Eurozone zum Dollarraum anhand ausgewählter Fragestellungen"
"04-2011-135","04","2011","WD 4 - 135/11","A","Auswirkungen der Übertragung eines Modells des Länderfinanzausgleichs auf die Europäische Union"
"04-2011-128","04","2011","WD 4 - 128/11","A","Fragen zur Vermögensteuer - Rechtfertigung sowie spezielle Probleme"
"04-2011-127","04","2011","WD 4 - 127/11","A","Immobilienmanagement des Bundes"
"04-2011-126","04","2011","WD 4 - 126/11","A","Einzelfragen zur Treuhandanstalt"
"04-2011-119","04","2011","WD 4 - 119/11","A","Unternehmensbesteuerung in Deutschland"
"04-2011-111","04","2011","WD 4 - 111/11","A","Fragen zum steuerrechtlichen Kinderexistenzminimum"
"04-2011-110","04","2011","WD 4 - 110/11","A","Fragenkatalog zur Besteuerung von Vermögen im Rahmen der deutschen Doppelbesteuerungsabkommen"
"04-2011-104","04","2011","WD 4 - 104/11","A","Steuervergünstigungen zur Förderung der Kultur"
"04-2011-101","04","2011","WD 4 - 101/11","A","Fragen zur Vermögensbesteuerung Deutschland, Frankreich, Großbritannien und den USA"
"04-2011-085","04","2011","WD 4 - 085/11","A","Fragen zu Geldüberweisungen von Migranten in ihre Heimatländer"
"04-2011-084","04","2011","WD 4 - 084/11","A","Eigenkapitalanforderungen für Staatsanleihen"
"04-2011-079","04","2011","WD 4 - 079/11","A","Anlagevorschriften für private Versicherungen, gesetzliche Rentenversicherung und die Versorgungsrücklage des Bundes"
"04-2011-075","04","2011","WD 4 - 075/11","A","Finanzverfassungsrechtliche Fragen zur Ausgestaltung des Europäischen Stabilitätsmechanismus (ESM)"
"04-2011-072","04","2011","WD 4 - 072/11","A","Instrumente des Zahlungsverkehrs nach geltenden Regeln und in der Single Euro Payments Area (SEPA)"
"04-2011-070","04","2011","WD 4 - 070/11","A","Elektronische Übermittlung von Bilanzen und Gewinn-und Verlustrechnungen"
"04-2011-048","04","2011","WD 4 - 048/11","A","Ermäßigter Mehrwertsteuersatz für Kultur, Zeitungen, Zeitschriften und Hotelübernachtungen (§ 12 Abs. 2 Umsatzsteuergesetz)"
"04-2011-046","04","2011","WD 4 - 046/11","A","Wertzuwachssteuer bei Immobilienverkäufen - Frankreich und Spanien"
"04-2011-043","04","2011","WD 4 - 043/11","A","Aufgaben der Deutschen Bundesbank und der Bundesanstalt für Finanzdienstleistungsaufsicht im internationalen Vergleich"
"04-2010-317","04","2010","WD 4 - 317/10","A","Grundprinzipien des Steuerrechts - Steuerarten und Steuerverteilung"
"04-2010-296","04","2010","WD 4 - 296/10","A","Fragen zum Jahressteuergesetz 2010"
"04-2010-292","04","2010","WD 4 - 292/10","A","Zulässigkeit eines kommunalen Hebesatzrechtes für den Gemeindeanteil an der Einkommensteuer"
"04-2010-286","04","2010","WD 4 - 286/10","A","Fragen zu § 3 Grundsteuergesetz (GrStG)"
"04-2010-275","04","2010","WD 4 - 275/10","A","Änderungen im Umsatzsteuerrecht seit 1967, Steuerermäßigungen nach § 12 UStG, Steuerbefreiungen nach § 4 UStG"
"04-2010-273","04","2010","WD 4 - 273/10","A","Reform der Ehegattenbesteuerung - Rechtsprechung des Verfassungsgerichts sowie Individualbesteuerungsmodelle"
"04-2010-247","04","2010","WD 4 - 247/10","A","Diskussion über die Neuordnung der Kommunalfinanzen"
"04-2010-245","04","2010","WD 4 - 245/10","A","Fragen zur Reform des Systems der Landesbanken"
"04-2010-240","04","2010","WD 4 - 240/10","A","Überblick über das System der öffentlichen Abgaben"
"04-2010-231","04","2010","WD 4 - 231/10","A","Sondervermögen des Bundes und Budgetrecht des Parlaments am Beispiel der Vereinbarung zum Atomkompromiss"
"04-2010-205","04","2010","WD 4 - 205/10","A","Überblick über die Besteuerung von Grundstücken und Verkehrsmitteln"
"04-2010-202","04","2010","WD 4 - 202/10","A","Fragen zum Umsatzsteuerbetrug in der BRD und der EU"
"04-2010-199","04","2010","WD 4 - 199/10","A","Steuerrechtlichen Vor- und Nachteile einer Gemeinnützige Gesellschaft mit beschränkter Haftung (GmbH) und einer Anstalt des öffentlichen Rechts (AöR)"
"04-2010-195","04","2010","WD 4 - 195/10","A","Rechtliche Aspekte einer kommunalen Waffenbesitzsteuer"
"04-2010-191","04","2010","WD 4 - 191/10","A","Aufgaben, Organisation und Rechtsgrundlagen der deutschen Börsen"
"04-2010-190","04","2010","WD 4 - 190/10","A","Rechtliche Aspekte einer Bankenaufsicht allein durch die BaFin oder durch eine neue Behörde"
"04-2010-188","04","2010","WD 4 - 188/10","A","Fragen zur steuerlichen Behandlung der Kirchen und deren Finanzen"
"04-2010-182","04","2010","WD 4 - 182/10","A","Fragen zu den deutschen Goldreserven"
"04-2010-159","04","2010","WD 4 - 159/10","A","Funktionsweise und Bedeutung von Kreditderivaten"
"04-2010-156","04","2010","WD 4 - 156/10","A","Besonderes Kirchgeld und Vorschläge zur Reform der Kirchensteuer"
"04-2010-149","04","2010","WD 4 - 149/10","A","Rechtlicher Rahmen der Einführung einer Kerosin-Steuer"
"04-2010-132","04","2010","WD 4 - 132/10","A","Zur inhaltlichen Richtigkeit des Gesetzentwurfs zur Übernahme von Gewährleistungen im Rahmen eines europäischen Stabilisierungsmechanismus"
"04-2010-128","04","2010","WD 4 - 128/10","A","Auswirkungen einer eventuellen Inanspruchnahme des Bundes aus der Garantieübernahme im Rahmen der Stabilisierungsmaßnahmen der Währungsunion auf den Bundeshaushalt und die Verschuldung"
"04-2010-127","04","2010","WD 4 - 127/10","A","Haushaltsrechtliche Rahmenbedingen der Gewährung von Zuwendungen"
"04-2010-122","04","2010","WD 4 - 122/10","A","Verfassungsrechtliche Voraussetzungen einer Zwangsanleihe für Griechenland"
"04-2010-121","04","2010","WD 4 - 121/10","A","Rechtliche Rahmenbedingungen zur Einführung einer Zwangsanleihe für Finanzinstitute in Deutschland"
"04-2010-087","04","2010","WD 4 - 087/10","A","Modelle zur Reform der Grundsteuer"
"04-2010-077","04","2010","WD 4 - 077/10","A","Interkommunale Umlagen im kommunalen Finanzausgleich"
"04-2010-074","04","2010","WD 4 - 074/10","A","IRAP - italienischen Regionalsteuer auf Produktionstätigkeiten"
"04-2010-066","04","2010","WD 4 - 066/10","A","Ausgestaltung und rechtliche Gesichtspunkte der Einführung eines Europäischen Währungsfonds"
"04-2010-053","04","2010","WD 4 - 053/10","A","Fragen im Zusammenhang mit der Diskussion über die Rolle Griechenlands im Euro-Raum"
"04-2010-047","04","2010","WD 4 - 047/10","A","Rechtliche Aspekte der Einführung einer Sonderabgabe für Kredit- und Finanzdienstleistungsinstitute"
"04-2010-046","04","2010","WD 4 - 046/10","A","Besteuerung von Scheingewinnen"
"04-2010-042","04","2010","WD 4 - 042/10","A","Bewertungsmethoden von Ratingagenturen sowie rechtliche Regelungen und Standards für ihre Tätigkeit"
"04-2010-040","04","2010","WD 4 - 040/10","A","Rolle der Umsatzsteuer und ihr Beitrag zur Finanzierung der sozialen Sicherungssysteme"
"04-2010-024","04","2010","WD 4 - 024/10","A","Zentralisierte und dezentralisierte Steuerverwaltung"
"04-2010-022","04","2010","WD 4 - 022/10","A","Amtshilfe in Steuersachen zwischen den EU-Staaten und Grundzüge des Gemeinnützigkeitsrechts in ausgewählten europäischen Staaten"
"04-2010-013","04","2010","WD 4 - 013/10","A","Zur Anwendung des ermäßigten Mehrwertsteuersatzes (u.a. auf Handwerkerleistungen in Frankreich) - Hintergründe und Erfahrungen"
"04-2010-001","04","2010","WD 4 - 001/10","A","Verfassungsrechtliche Prüfmaßstäbe einer Kultur- oder Ethiksteuer"
"04-2009-183","04","2009","WD 4 - 183/09","A","Fragen zur Gewerbesteuer in Deutschland und internationaler Vergleich"
"04-2009-181","04","2009","WD 4 - 181/09","A","Zur Staatsverschuldung in Griechenland"
"04-2009-170","04","2009","WD 4 - 170/09","A","Umsatzsteuerliche Behandlung von Beherbergungsleistungen"
"04-2009-145","04","2009","WD 4 - 145/09","AI","Steuerrecht für Abgeordnete"
"04-2009-142","04","2009","WD 4 - 142/09","A","Haushaltsrechtliche Grundlagen Nachtragshaushalte"
"04-2009-141","04","2009","WD 4 - 141/09","A","Entwicklung der Staatsverschuldung von 1970 bis 2013"
"04-2009-134","04","2009","WD 4 - 134/09","A","Fragen zum Spannungsverhältnis des Primärrechts der Europäischen Union zu der Forderung nach einer Re-Regulierung der Finanzmärkte"
"04-2009-133","04","2009","WD 4 - 133/09","A","Die Erbschaft- und Vermögensteuer in den EU-Mitgliedstaaten, Australien, Japan, Kanada und den USA (aktualisierte Fassung)"
"04-2009-132","04","2009","WD 4 - 132/09","A","Verteilungs- und Beschäftigungseffekte der Erhöhung der Umsatz- und Versicherungsteuer im Jahre 2007, der Anwendung ermäßigter Mehrwertsteuersätze auf arbeitsintensive Dienstleistungen und Reformvorschläge zur Ökosteuer"
"04-2009-127","04","2009","WD 4 - 127/09","A","Möglichkeiten der Lohnsteuerpauschalierung bei Sach- und Barzuwendungen"
"04-2009-120","04","2009","WD 4 - 120/09","A","Die Auswirkungen der Föderalismusreformen I und II auf die Finanzverfassung"
"04-2009-115","04","2009","WD 4 - 115/09","A","Besteuerung und Sozialversicherungspflicht bei Beschäftigung deutscher Arbeitnehmer in Belgien"
"04-2009-114","04","2009","WD 4 - 114/09","A","Steuer- und Abgabenbelastung für das Hotel- und Gaststättengewerbe in Deutschland, Frankreich, Österreich, der Schweiz und der Tschechischen Republik"
"04-2009-105","04","2009","WD 4 - 105/09","A","Die Erbschaft- und Vermögensteuer in den EU-Mitgliedstaaten, Australien, Japan, Kanada und den USA"
"04-2009-097","04","2009","WD 4 - 097/09","A","Die Reichweite des bündischen Prinzips bei Überschuldung/Zahlungsunfähigkeit eines Bundeslandes"
"04-2009-094","04","2009","WD 4 - 094/09","A","Bankensystem und Bankenaufsicht in Deutschland"
"04-2009-080","04","2009","WD 4 - 080/09","A","Der Nichtanwendungserlass im Steuerrecht"
"04-2009-075","04","2009","WD 4 - 075/09","A","Verlauf der Finanzkrise - Entstehungsgründe, Verlauf und Gegenmaßnahmen"
"04-2009-074","04","2009","WD 4 - 074/09","A","Förderung von bürgerschaftlichem Engagement durch Verbesserung der Einkommenssituation"
"04-2009-067","04","2009","WD 4 - 067/09","A","Finanzmarktpolitische Reaktionen auf die Finanzkrise"
"04-2009-062","04","2009","WD 4 - 062/09","A","Möglichkeiten des Entzugs der Bankerlaubnis nach nationalem und europäischem Recht"
"04-2009-058","04","2009","WD 4 - 058/09","A","Sonderregelungen für ehemals gemeinnützige Wohnungsunternehmen nach § 13 KStG"
"04-2009-044","04","2009","WD 4 - 044/09","A","Bisherige Mitarbeiterbeteiligungsmodelle und Neuerungen durch das Mitarbeiterkapitalbeteiligungsgesetz"
"04-2009-042","04","2009","WD 4 - 042/09","A","Aufsicht und Regulierung der Finanzmärkte auf nationaler Ebene, in der EU und auf internationaler Ebene"
"04-2009-028","04","2009","WD 4 - 028/09","A","Auswirkungen des Urteils des Bundesverfassungsgerichts zum Abgabenfondsgesetz"
"04-2009-026","04","2009","WD 4 - 026/09","A","Auswirkungen der Anwendung reduzierter Mehrwertsteuersätze auf arbeitsintensive Dienstleistungen"
"04-2009-021","04","2009","WD 4 - 021/09","A","Die Rolle deutscher Kreditinstitute bei Steuerhinterziehung und Steuerflucht - Teilbereich Aufsichts- und Steuerrecht, Amtshilfe- und Informationsabkommen"
"04-2009-019","04","2009","WD 4 - 019/09","A","Fragenkatalog bezüglich der parlamentarischen Haushaltskontrolle und der finanziellen Autonomie des Deutschen Bundestages"
"04-2009-011","04","2009","WD 4 - 011/09","A","Zur Diskussion über eine Bad Bank"
"04-2009-007","04","2009","WD 4 - 007/09","A","Das novellierte Erbschaftsteuergesetz"
"04-2009-005","04","2009","WD 4 - 005/09","A","Verschiedene Fragen zur finanziellen Förderung der evangelischen und der katholischen Kirche durch Bund, Länder und Gemeinden"
"04-2008-222","04","2008","WD 4 - 222/08","A","KFZ-Steuer auf CO2-Basis"
"04-2008-218","04","2008","WD 4 - 218/08","A","Meldepflichten im Wertpapierhandel"
"04-2008-199","04","2008","WD 4 - 199/08","A","Verschiedene Fragestellungen zu Steuern und Sozialabgaben"
"04-2008-193","04","2008","WD 4 - 193/08","A","Steuerliche Erleichterungen für Menschen mit Behinderungen - Darstellung des aktuellen Rechtsstands und der Entwicklung der letzten 20 Jahre"
"04-2008-188","04","2008","WD 4 - 188/08","A","Der rechtliche Rahmen für die Einführung einer Rubbellos- Sonderbriefmarke in Deutschland"
"04-2008-176","04","2008","WD 4 - 176/08","A","Rechtliche Rahmenbedingungen einer Vermögensabgabe"
"04-2008-156","04","2008","WD 4 - 156/08","A","Einzelfragen zum Haushalt des Deutschen Bundestages"
"04-2008-151","04","2008","WD 4 - 151/08","A","Zahlungsunfähige Staaten in den letzten 20 Jahren"
"04-2008-148","04","2008","WD 4 - 148/08","A","Änderungen bei der Unternehmensbesteuerung, insbesondere bei der Gewerbesteuer"
"04-2008-136","04","2008","WD 4 - 136/08","A","Föderalismus und Steuerwettbewerb in Deutschland und der EU"
"04-2008-129","04","2008","WD 4 - 129/08","A","Besteuerung von Windfall-Profits im Rahmen des Emissionshandels"
"04-2008-105","04","2008","WD 4 - 105/08","A","Fragen zu den Goldbeständen der Deutschen Bundesbank"
"04-2008-102","04","2008","WD 4 - 102/08","A","Finanz- und aufsichtsrechtliche Fragen zum Handel an der Energiebörse EEX"
"04-2008-091","04","2008","WD 4 - 091/08","A","Besteuerung von Kapitalerträgen und Veräußerungsgewinnen in ausgewählten EU-Staaten"
"04-2008-083","04","2008","WD 4 - 083/08","A","Umsatzsteuer auf Fotokunst in Deutschland und anderen EU-Staaten"
"04-2008-081","04","2008","WD 4 - 081/08","A","Ausnahmen vom Umsatzsteuer-Regelsatz und deren Begründung"
"04-2008-071","04","2008","WD 4 - 071/08","A","Absetzbarkeit von Spenden aus dem EU-Ausland an eine Stiftung nach deutschem Recht"
"04-2008-062","04","2008","WD 4 - 062/08","A","Reichweite des haushaltsrechtlichen Parlamentsvorbehalts"
"04-2008-043","04","2008","WD 4 - 043/08","A","Steuermoral und Steuerflucht"
"04-2008-040","04","2008","WD 4 - 040/08","A","Das Federal Reserve System - Entstehungsgeschichte, Grundlage, Aufbau"
"04-2008-037","04","2008","WD 4 - 037/08","A","Das Federal Reserve System"
"04-2008-029","04","2008","WD 4 - 029/08","A","Entwicklungen und Stand der Bemühungen zur Reform der Erbschaft- und Schenkungsteuer"
"04-2008-018","04","2008","WD 4 - 018/08","A","Europarechtskonformität des „acting in concert“ nach dem Risikobegrenzungsgesetz"
"04-2007-237","04","2007","WD 4 - 237/07","A","Einzelfragen zur steuerlichen Freistellung des Familienexistenzminimums"
"04-2007-225","04","2007","WD 4 - 225/07","A","Kostensteigerung bei Bundesbauprojekten unter Berücksichtigung der Veranschlagungsgrundsätze der Bundeshaushaltsordnung"
"04-2007-223","04","2007","WD 4 - 223/07","A","Steuergestaltung von Freiberuflern und Selbstständigen"
"04-2007-222","04","2007","WD 4 - 222/07","A","Die Ausgestaltung KfZ-bezogener Steuervorschriften nach ökologischen Kriterien"
"04-2007-208","04","2007","WD 4 - 208/07","A","Kirchengebäudeerhalt durch Bundesmittel"
"04-2007-202","04","2007","WD 4 - 202/07","A","Die geplante Einschränkung des Höchstbetrages für den Sonderausgabenabzug von Vorsorgebeiträgen nach § 10 Abs. 3 Satz 3 EStG im Entwurf des Jahressteuergesetz 2008"
"04-2007-200","04","2007","WD 4 - 200/07","A","Gründe für die Abschaffung bzw. Einführung verschiedener Steuervorschriften für Auslandsinvestitionen"
"04-2007-196","04","2007","WD 4 - 196/07","A","Die Auswirkungen der Bildung von Stammkapital im Sparkassenrecht"
"04-2007-190","04","2007","WD 4 - 190/07","A","Abgabenrechtliche Einordnung von Rundfunkgebühr und Medienabgabe"
"04-2007-180","04","2007","WD 4 - 180/07","A","Zusammenhang zwischen der Finanzkraft von Städten und Gemeinden und der Höbe des Gewerbesteuer-Hebesatzes"
"04-2007-178","04","2007","WD 4 - 178/07","A","Zur Möglichkeit der finanziellen Unterstützung entwicklungspolitischer Projekte durch Bundestagsausschüsse auf Dienstreisen aus Mitteln der Bundesregierung"
"04-2007-177","04","2007","WD 4 - 177/07","A","Steuerliche Absetzbarkeit von haushaltsnahen Dienstleistungen und von Aufwendungen für die Kinderbetreuung"
"04-2007-169","04","2007","WD 4 - 169/07","A","Girokonto für Jedermann auf Guthabenbasis (Einzelfragen)"
"04-2007-164","04","2007","WD 4 - 164/07","A","Einzelfragen zu militärischen Beschaffungen durch Leasing"
"04-2007-152","04","2007","WD 4 - 152/07","A","Steuerliche Förderung von Forschung und Entwicklung in Unternehmen - Eine Darstellung des britischen und des kanadischen Modells"
"04-2007-149","04","2007","WD 4 - 149/07","A","Steuerliche Förderung für Forschung und Entwicklung in Unternehmen"
"04-2007-144","04","2007","WD 4 - 144/07","A","Maßnahmen zur Senkung der steuerlichen Attraktivität von Unternehmensteilverlagerungen in Niedrigsteuerländer und ihre Probleme"
"04-2007-143","04","2007","WD 4 - 143/07","A","Die Renditeentwicklung ausgewählter Volksaktien"
"04-2007-138","04","2007","WD 4 - 138/07","A","Die Börsenumsatzsteuer in Großbritannien und Belgien als mögliche Modelle für Deutschland"
"04-2007-136","04","2007","WD 4 - 136/07","A","Rechtliche Aspekte der Übertragung der Bankenaufsicht auf die Deutsche Bundesbank"
"04-2007-131","04","2007","WD 4 - 131/07","A","Fragen zur Aufsicht und Zusammenarbeit in der Steuerverwaltung"
"04-2007-129","04","2007","WD 4 - 129/07","A","Die Vorteile des Familienstandes der Ehe in Bezug auf steuerliche Fragen"
"04-2007-126","04","2007","WD 4 - 126/07","A","Einzelfragen zum Verfahren der Rechnungslegung des Bundes"
"04-2007-120","04","2007","WD 4 - 120/07","A","Übersicht über die aktuelle Energiebesteuerung in Deutschland"
"04-2007-117","04","2007","WD 4 - 117/07","A","Entwicklung ausgewählter Wirtschaftsindikatoren in Argentinien und Brasilien seit 1999"
"04-2007-116","04","2007","WD 4 - 116/07","A","Die Stromsteuer in Deutschland; Konzept, Vor- und Nachteile sowie Stromsteuern in anderen EU-Ländern"
"04-2007-113","04","2007","WD 4 - 113/07","A","Die Finanzaufsicht über ausländische Beteiligungsgesellschaften in Deutschland"
"04-2007-112","04","2007","WD 4 - 112/07","A","Anpassung des Einkommensteuertarifs an die inflationäre Entwicklung in ausgewählten Staaten"
"04-2007-104","04","2007","WD 4 - 104/07","A","Verschiedene Fragen zur Hinzurechnungsbesteuerung des Außensteuergesetzes nach dem Cadbury Schweppes Urteil des EuGH"
"04-2007-100","04","2007","WD 4 - 100/07","A","Die Finanzverfassung der Schweiz und der Bundesrepublik Deutschland"
