"ID","Abteilung","Jahr","Aktenzeichen","Status","Titel"
"11-2015-070","11","2015","PE 6 - 070/15","A","Vereinbarkeit des „Entwurfs eines Gesetzes zur Einführung einer Speicherpflicht und einer Höchstspeicherfrist für Verkehrsdaten“ mit dem EuGH-Urteil vom 8, April 2014"
"11-2015-065","11","2015","PE 6 - 065/15","A","Kommunale Kultur-Eigenbetriebe und EU-Beihilfenrecht"
"11-2015-063","11","2015","PE 6 - 063/15","A","Die Vereinbarkeit einer nationalen Holzkennzeichnungspflicht mit EU-Recht"
"11-2015-060","11","2015","PE 6 - 060/15","A","Auswirkungen der sog. „Enforcement Workshops“ der Europäischen Kommission auf die Handlungsbefugnisse des Deutschen Bundestages bei der Umsetzung von Richtlinien"
"11-2015-057","11","2015","PE 6 - 057/15","A","Die rechtliche Einbindung einer Verkehrsinfrastrukturgesellschaft und ÖPP in die europäische Schuldenregel"
"11-2015-053","11","2015","PE 6 - 053/15","A","Europarechtliche Spielräume zur Einführung einer Speicherpflicht und Höchstspeicherfrist für Verkehrsdaten in den Mitgliedstaaten der Europäischen Union"
"11-2015-051","11","2015","PE 6 - 051/15","A","Die Mitgliedschaft im „Netzwerk gentechnikfreier Regionen in Europa“ als Begründung für ein Verbot des Anbaus von gentechnisch veränderten Organismen"
"11-2015-049","11","2015","PE 6 - 049/15","A","Vorläufiger Rechtsschutz vor Unionsgerichten gegenüber Maßnahmen der EZB im Zusammenhang mit der Liquidiatätsversorgung von mitgliedstaatlichen Gechäftsbanken"
"11-2015-048","11","2015","PE 6 - 048/15","A","Allgemeine Steuergutschrift für Forschungs- und Entwicklungsaufwendungen für KMU und EU-Beihilferecht"
"11-2015-046","11","2015","PE 6 - 046/15","A","Unionsrechtliche Anforderungen an einen Beitritt der EU zum Europarat"
"11-2015-045","11","2015","PE 6 - 045/15","A","Verfahrensrechtliche Anforderungen des Unionsrechts bei der Einführung eines Leistungsschutzrechts für Presseverleger"
"11-2015-044","11","2015","PE 6 - 044/15","A","Unionsrechtliche Regelungen zur strafrechtlichen Verfolgung von Hassreden"
"11-2015-043","11","2015","PE 6 - 043/15","A","Fragen zu einem unionsrechtlichen Import- und Handelsverbot von mit Frackingsmethoden geförderten fossilen Energieträgern"
"11-2015-042","11","2015","PE 6 - 042/15","A","Regulierung von Kosmetika im Rahmen der Verhandlungen für ein transatlantisches Handels- und Investitionsabkommen (Transatlantic Trade and Investment Partnership (TTIP))"
"11-2015-040","11","2015","PE 6 - 040/15","A","Unionsrechtliche Regelungen zur Strafbarkeit von Hassreden"
"11-2015-037","11","2015","PE 6 - 037/15","A","Einseitige mitgliedstaatliche Kündigung von EU-Freihandelsabkommen"
"11-2015-036","11","2015","PE 6 - 036/15","A","Zur Anwendung der AIFM-RL auf Genossenschaften"
"11-2015-034","11","2015","PE 6 - 034/15","A","Beteiligung der Mitgliedstaaten am europäischen Emissionszertifikatehandel"
"11-2015-032","11","2015","PE 6 - 032/15","A","Unionsrechtliche Anforderungen an eine europäische Vorabprüfung von Finanzmarktprodukten"
"11-2015-027","11","2015","PE 6 - 027/15","A","Fragen zur Liquiditätsversorgung von Kreditinstituten durch die EZB"
"11-2015-026","11","2015","PE 6 - 026/15","A","Eintragung von Unionsbürgern in das Wählerverzeichnis bei Europawahlen"
"11-2015-025","11","2015","PE 6 - 025/15","A","Unionsrechtliche Zulässigkeit von Invenstor-Staat-Schiedsverfahren in Freihandelsabkommen der Europäischen Union (EU)"
"11-2015-021","11","2015","PE 6 - 021/15","A","Der Grundsatz der gegenseitigen Anerkennung in Freihandelsabkommen"
"11-2015-020","11","2015","PE 6 - 020/15","A","Subventionierung neuer Gaskraftwerke im Lichte des EU-Beihilferechts"
"11-2015-019","11","2015","PE 6 - 019/15","A","Fragen zur Beteiligung der Europäischen Zentralbank im Rahmen des Europäischen Stabilitätsmechanismus"
"11-2015-016","11","2015","PE 6 - 016/15","A","Unionsrechtliche Anforderungen an eine Kennzeichnung von Getränkeverpackungen mit „Einweg“ oder „Mehrweg“"
"11-2015-014","11","2015","PE 6 - 014/15","A","Hafenkooperation in Norddeutschland im Lichte des EU-Kartellrechts"
"11-2015-012","11","2015","PE 6 - 012/15","A","Potenzielle Auswirkungen des Comprehensive Economic and Trade Agreements (CETA) auf das Nachtflugverbot am Flughafen Frankfurt am Main"
"11-2015-009","11","2015","PE 6 - 009/15","A","Unionsrechtliche Relevanz einer Unterscheidung bei der Erwerbsmöglichkeit von Kurzzeitvignetten"
"11-2015-008","11","2015","PE 6 - 008/15","A","Die Vereinbarkeit von Positivlisten für legal zu haltende Heimtiere mit Unionsrecht"
"11-2015-002","11","2015","PE 6 - 002/15","A","Unionsrechtliche Zulässigkeit einer nach Straßenart differenzierenden Infrastruktur"
"11-2014-221","11","2014","PE 6 - 221/14","A","Fragen zu den Ratifikationserfordernissen des Comprehensive Economic and Trade Agreements (CETA)"
"11-2014-220","11","2014","PE 6 - 220/14","A","Vereinbarkeit der Gesetzentwürfe zur Einführung einer Infrastrukturabgabe und zur Reform des Kraftfahrzeugsteuergesetzes mit dem Verbot der Diskriminierung aus Gründen der Staatsangehörigkeit"
"11-2014-217","11","2014","PE 6 - 217/14","A","Ansprüche von Unionsbürgern auf Grundsicherung für Arbeitsuchende"
"11-2014-215","11","2014","PE 6 - 215/14","A","Unionsrechtskonformität des Entwurfs eines neuen § 2b Umsatzsteuergesetz (§ 2 b UStG-E)"
"11-2014-212","11","2014","PE 6 - 212/14","A","Vereinbarkeit der Gesetzentwürfe zur Einführung einer Infrastrukturabgabe und zur Reform des Kraftfahrzeugsteuergesetzes mit dem Unionsrecht"
"11-2014-207","11","2014","PE 6 - 207/14","A","Möglichkeiten der Mitgliedstaaten der Europäischen Union, die Einhaltung der Dublin III-Verordnung durch andere Mitgliedstaaten einzufordern"
"11-2014-206","11","2014","PE 6 - 206/14","A","Unionsrechtliche Voraussetzungen für einen Einsatz von Körperscannern"
"11-2014-205","11","2014","PE 6 - 205/14","A","Verfahren zur Sicherung der Grundwerte und Grundrechte in der Europäischen Union"
"11-2014-201","11","2014","PE 6 - 201/14","A","Vereinbarkeit des Vorschlags zur Neufassung von § 7 Abs. 2 FreizügigG/EU-E im Hinblick auf die Einführung von Wiedereinreisesperren mit dem Unionsrecht"
"11-2014-200","11","2014","PE 6 - 200/14","A","EU-Beihilferechtliche Beurteilung von Ausfallbürgschaften bei Energieinspar-Contracting-Maßnahmen"
"11-2014-197","11","2014","PE 6 - 197/14","A","Voraussetzungen für eine Verwendung von Finanzmitteln des Europäischen Stabilitätsmechanismus für ein europäisches Investitionsprogramm"
"11-2014-196","11","2014","PE 6 - 196/14","A","Rechtsschutz gegen einen Kommissionsbeschluss im EU-Beihilferecht - Zur Klageberechtigung potentieller Kläger im Hinblick auf den Beschluss der Kommission in Sachen AKW Hinkley Point C"
"11-2014-195","11","2014","PE 6 - 195/14","A","Fragen zur direkten Bankenrekapitalisierung durch den Europäischen Stabilitätsmechanismus"
"11-2014-194","11","2014","PE 6 - 194/14","A","Stand der Beratungen über eine Datenschutzgrundverordnung"
"11-2014-190","11","2014","PE 6 - 190/14","A","Auswirkungen des Comprehensive Economic ans Trade Agreements (CETA) auf die Regelungen der EU-Kraftstoffqualitätsrichtlinie 2009/30/EG"
"11-2014-188","11","2014","PE 6 - 188/14","A","Konsequenzen der neuen MiFID-II-Richtinie und der MiFIR-Verordnung für Hochfrequenzhandel und Nahrungsmittelspekulation"
"11-2014-187","11","2014","PE 6 - 187/14","A","Der unionsrechtliche Unternehmensbegriff und seine Konsequenzen für die Ausgabe von Arzneimitteln durch den Staat bzw. öffentliche Einrichtungen"
"11-2014-184","11","2014","PE 6 - 184/14","A","Europarechtliche Spielräume zur Befragung und Auskunftspflicht nach § 22 Abs. la BPolG"
"11-2014-183","11","2014","PE 6 - 183/14","A","Wirkungen von Resolutionen des VN-Sicherheitsrates auf europäisches Sekundärrecht"
"11-2014-182","11","2014","PE 6 - 182/14","A","Fragen zur vorläufgen Anwendung des Comprehensive Economic and Trade Agreements (CETA)"
"11-2014-181","11","2014","PE 6 - 181/14","A","Handlungsgrundlagen der Europäischen Zentralbank für den Ankauf von Asset-Backed-Securities (ABS)"
"11-2014-177","11","2014","PE 6 - 177/14","A","Zur Vereinbarkeit einer steuerlichen Anlaufhemmung für nicht erklärte ausländische Kapitalerträge mit Unionsrecht"
"11-2014-174","11","2014","PE 6 - 174/14","A","Europarechtliche Gestaltungsspielräume für nationale Vorgaben zur Zusammensetzung von Babynahrung"
"11-2014-173","11","2014","PE 6 - 173/14","A","Fragen zur vorläufigen Anwendung des Comprehensive Economic and Trade Agreements (CETA)"
"11-2014-171","11","2014","PE 6 - 171/14","A","Möglichkeiten eines Opt-Outs einzelner EU-Mitgliedstaaten im Hinblick auf die Bestimmungen über ein Investor-Staat-Streitverfahren im Comprehensive Economic and Trade Agreement (CETA) und der Transatlantic Trade and Investment Partnership (TTIP)"
"11-2014-168","11","2014","PE 6 - 168/14","A","Unionsrechtliche Zulässigkeit einer Inländerdiskriminierung durch die sog. PKW-Maut bzw. Infrastrukturabgabe"
"11-2014-165","11","2014","PE 6 - 165/14","A","Staatliche Förderung der Instandhaltung neuer Bremstechniken im Schienengüterverkehr und EU-Beihilfenrecht"
"11-2014-164","11","2014","PE 6 - 164/14","A","EU-Sanktionen gegen Russland - Rechtsgrundlagen und Rechtmäßigkeit restriktiver Maßnahmen der EU gegenüber dem Vorsitzenden der Staatsduma"
"11-2014-157","11","2014","PE 6 - 157/14","A","Fragen zur Reform des Freizügigkeitsgesetzes/EU"
"11-2014-153","11","2014","PE 6 - 153/14","A","Fragen zum Inhalt und den Ratifikationsverfahren des Comprehensive Economic and Trade Agreements (CETA) und des Abkommens über eine Transatlantische Handels- und Investitionspartnerschaft (TTIP)"
"11-2014-152","11","2014","PE 6 - 152/14","A","Abschluss des Comprehensive Econimics and Trade Agreements (CETA) als gemischtes Abkommen oder als EU-Abkommen"
"11-2014-146","11","2014","PE 6 - 146/14","A","Unionsrechtliche Fragen zur Dauer der Facharztausbildung bei Teilzeitausbildung"
"11-2014-144","11","2014","PE 6 - 144/14","A","Fragen zur Vereinbarkeit des Vorschlags für eine PKW-Maut bzw. Infrastrukturabgabe mit dem Unionsrecht"
"11-2014-139","11","2014","PE 6 - 139/14","A","Vereinbarkeit des Vorschlags für eine PKW-Maut bzw. Infrastrukturabgabe mit dem Unionsrecht"
"11-2014-133","11","2014","PE 6 - 133/14","A","Obergrenzen der Gläubigerbeteiligung im Gesetzentwurf der Bundesregierung für das BRRD-Umsetzungsgesetz"
"11-2014-132","11","2014","PE 6 - 132/14","A","Unionsrechtliche Fragen zur Reform des Staatsangehörigkeitsrechts"
"11-2014-131","11","2014","PE 6 - 131/14","A","Vereinbarkeit des Vorschlags für eine PKW-Maut bzw. Infrastrukturabgabe mit dem Unionsrecht"
"11-2014-129","11","2014","PE 6 - 129/14","A","Mitgliedstaatliche Verbote von Weichmachern"
"11-2014-128","11","2014","PE 6 - 128/14","A","Besteuerung von Schulverpflegung"
"11-2014-127","11","2014","PE 6 - 127/14","A","Unionsrechtliche Anforderungen an ein Punktsystem bei der Zuwanderung"
"11-2014-126","11","2014","PE 6 - 126/14","A","Unionsrechtliche Vorgaben für die Inhaberschaft von Arzneimittelzulassungen"
"11-2014-124","11","2014","PE 6 - 124/14","A","Transport und Schlachtung trächtiger Kühe"
"11-2014-119","11","2014","PE 6 - 119/14","A","Fragen zu den Aufgaben der Europäischen Kommission im Rahmen der Verhandlungen für ein Abkommen über eine Transatlantische Handels- und Investitionspartnerschaft (TTIP)"
"11-2014-118","11","2014","PE 6 - 118/14","A","Europarechtliche Fragen zur Einführung einer Opt-out-Möglichkeit der Mitgliedstaaten für den Anbau gentechnisch veränderter Organismen (Opt-out GVO)"
"11-2014-117","11","2014","PE 6 - 117/14","A","Anforderungen der EU an die Beitrittsländer in Bezug auf die Demokratisierung und Projekte zur Demokratieförderung anlässlich des Beitritts Kroatiens zur EU"
"11-2014-116","11","2014","PE 6 - 116/14","A","Fragen zu Aspekten des geplanten Investitionsschutzabkommens zwischen der EU und China"
"11-2014-112","11","2014","PE 6 - 112/14","AG","Lösung von einem Investor-Staat-Streitbeilegungsmechanismus im Rahmen des Abkommens über eine Transatlantische Handels- und Investitionspartnerschaft (Transatlantic Trade and Investment Partnership TTIP) - NfD -"
"11-2014-108","11","2014","PE 6 - 108/14","A","Fragen zur Datenschutzgrundverordnung"
"11-2014-106","11","2014","PE 6 - 106/14","A","Fragen zu den Möglichkeiten der EU-Mitgliedstaaten für ein Anbauverbot von gentechnisch veränderten Organismen"
"11-2014-102","11","2014","PE 6 - 102/14","A","Nationale Geschlechterquote für die Arbeitnehmerseite von Aufsichtsräten in Europäischen (Aktien-)Gesellschaften"
"11-2014-098","11","2014","PE 6 - 098/14","A","Abwrackprämie für Schiffe und ihre Vereinbarkeit mit EU-Beihilferecht"
"11-2014-097","11","2014","PE 6 - 097/14","AI","Das Aufenthaltsrecht von Unionsbürgern aus anderen Mitgliedstaaten der Europäischen Union und ihr Zugang zu Grundsicherungsleistungen im Aufenthalts Staat unter besonderer Berücksichtigung der Rechtslage in Deutschland"
"11-2014-092","11","2014","PE 6 - 092/14","A","Unionsrechtliche Regelungen zu Heimtiertransporten"
"11-2014-090","11","2014","PE 6 - 090/14","A","Erweiterung der Bemessungsgrundlage der geplanten Finanztransaktionssteuer um Devisentransaktionen"
"11-2014-086","11","2014","PE 6 - 086/14","A","Unionsrechtliche Zulässigkeit einer degressiven Abschreibung von Wohnraum in Ballungszentren"
"11-2014-084","11","2014","PE 6 - 084/14","A","Verfahren zur Änderung der EU-Freisetzungsrichtlinie"
"11-2014-078","11","2014","PE 6 - 078/14","A","Zur Diskussion der Ausbringung von Genmais-1507 in den Mitgliedstaaten"
"11-2014-066","11","2014","PE 6 - 066/14","A","Europarechtliche Fragen eines nationalen Opt-Outs des Anbaus von Genmais-1507"
"11-2014-064","11","2014","PE 6 - 064/14","A","Der Ausbau von Genmais-1507 in der Bundesrepublik Deutschland - Europarechtliche Aspekte einer nationalen Opt-Out-Regelung"
"11-2014-063","11","2014","PE 6 - 063/14","A","Der Anbau von Genmais-1507 in der EU"
"11-2014-047","11","2014","PE 6 - 047/14","A","Die Berücksichtigung der Rentenreform im Rahmen der haushalts- und fiskalpolitischen Pflichten der Wirtschafts- und Währungsunion"
"11-2014-041","11","2014","PE 6 - 041/14","A","Fragen zu den Verhandlungen über eine Finanztransaktionssteuer im Wege der Verstärkten Zusammenarbeit"
"11-2014-034","11","2014","PE 6 - 034/14","A","Fragen zum Einheitlichen Abwicklungsmechanismus (SRM) und Einheitlichen Abwicklungsfonds (SRF)"
"11-2014-014","11","2014","PE 6 - 014/14","A","Fragen zu Art. 13 Fiskalvertrag und zu Maßnahmen der Eurorettung"
"11-2014-008","11","2014","PE 6 - 008/14","A","Kürzung des Kindergeldes und EU-Recht"
"11-2014-005","11","2014","PE 6 - 005/14","A","Vergaberecht und die Teilnahme der Sanitätsdienste der Bundeswehr am zivilen Notfall- und Rettungsdienst"
"11-2014-002","11","2014","PE 6 - 002/14","A","Mindestlohnvorschriften mit Ausnahmeregelungen für bestimmte Personengruppen - Vereinbarkeit mit dem Europarecht"
"11-2014-001","11","2014","PE 6 - 001/14","A","EU-rechtliche Spielräume für eine Zugangssteuerung zu Leistungen der Grundsicherung für Arbeitsuchende aus EU-Staaten"
"11-2013-134","11","2013","PE 6 - 134/13","A","Fragen zum Sonderbericht des Europäischen Rechnungshofes „European Union Direct Financial Support to the Palestinian Authority“"
"11-2013-126","11","2013","PE 6 - 126/13","A","Europäische Rahmenbedingungen einer nationalen Zuwanderungsgesetzgebung"
"11-2013-125","11","2013","PE 6 - 125/13","A","Einflüsse der jüngeren Rechtsprechung des EuGH auf Grundsicherungsansprüche von Unionsbürgern"
"11-2013-121","11","2013","PE 6 - 121/13","A","Tierkörperbeseitigung und EU-Beihilfenrecht - Entsorgung gefallener Tiere durch Kommunen nach dem Entwurf der Agrar-Freistellungsverordnung"
"11-2013-120","11","2013","PE 6 - 120/13","A","Kroatisches Gesetz über den Aufenthaltsort - Zur Vereinbarkeit mit dem EU-Recht"
"11-2013-112","11","2013","PE 6 - 112/13","A","Stellvertretung des Hohen Vertreters für die GASP und GSVP"
"11-2013-110","11","2013","PE 6 - 110/13","A","Vereinbarkeit des Vorschlags zur Neufassung der Tabakproduktrichtlinie mit dem Subsidiaritätsgrundsatz"
"11-2013-109","11","2013","PE 6 - 109/13","A","Förderung der Betriebsmehrkosten der Halter von Schienengüterwagen mit nachgerüsteten Verbundstoffbremssohlen"
"11-2013-108","11","2013","PE 6 - 108/13","A","Visumpflicht für türkische Geschäftsleute"
"11-2013-092","11","2013","PE 6 - 092/13","A","Durchsuchungs- und Vernichtungsaktion bei der britischen Tageszeitung „The Guardian“ - Verstoß gegen die Europäische Grundrechte-Charta"
"11-2013-090","11","2013","PE 6 - 090/13","A","Fragen zur Klage des Vereinigten Königreichs gegen den Ratsbeschluss 2013/52/EU über die Ermächtigung zu einer Verstärkten Zusammenarbeit im Bereich der Finanztransaktionssteuer (EuGH, Rs. C-209/13)"
"11-2013-087","11","2013","PE 6 - 087/13","A","Fragen zur EU-Kompetenz für die Ausweisung der Ostsee als Emissionsüberwachungsgebiet für Stickstoffoxid (NECA)"
"11-2013-085","11","2013","PE 6 - 085/13","A","Einzelfragen zur geplanten Verordnung des Europäischen Parlaments und des Rates über klinische Prüfungen mit Humanarzneimitteln"
"11-2013-079","11","2013","PE 6 - 079/13","A","Zur Richtlinie 2006/40/EG über Emissionen aus Klimaanlagen in Kraftfahrzeugen - Sanktionen für richtlinienwidrig produzierte und zugelassene der Genehmigungsbehörde, nachträglichen Erweiterung einer Typengenehmigung Fahrzeuge, Rechtsmittel gegen Entscheidungen"
"11-2013-078","11","2013","PE 6 - 078/13","A","Der Kommissionsvorschlag für eine Konzessionsrichtlinie und Gesundheitsdienstleistungen"
"11-2013-076","11","2013","PE 6 - 076/13","A","Transatlantic Trade and Investment Partnership (TTIP) und Investor-Staat-Streitbeilegungsmechanismen"
"11-2013-074","11","2013","PE 6 - 074/13","A","Fragen zur Anwendung der Safe Harbor Grundsätze zwischen der EU und den USA"
"11-2013-072","11","2013","PE 6 - 072/13","A","Das Mandat der Europäischen Zentralbank im Rahmen der Troika"
"11-2013-067","11","2013","PE 6 - 067/13","A","Zentrale europäische Abwicklungsbehörde und gemeinsamer europäischer Abwicklungsfonds im Rahmen der Bankenunion - Zur Frage der Notwendigkeit einer Vertragsänderung"
"11-2013-065","11","2013","PE 6 - 065/13","A","Fragen zum Bewertungsverfahren von Immobilien - Sondervermögen im Rahmen von alternativen Investmentfonds"
"11-2013-064","11","2013","PE 6 - 064/13","A","Vollzeit-Präsident für die Eurogruppe - Vereinbarkeit mit den EU-Verträgen und Wählbarkeit aus den Reihen der nationalen Finanzminister der Euro-Staaten?"
"11-2013-063","11","2013","PE 6 - 063/13","A","Fragen zur geplanten Europäischen Waldkonvention"
"11-2013-061","11","2013","PE 6 - 061/13","A","Rebenzüchtung in Deutschland und EU-Wettbewerbsrecht"
"11-2013-056","11","2013","PE 6 - 056/13","A","Immunitäten, Sonderrechte und Gehälter der Direktoriumsmitglieder und Angestellten der Europäischen Zentralbank"
"11-2013-051","11","2013","PE 6 - 051/13","A","EU-Rechtliche Vorgaben für die etwaige Aufnahme von Beratungsleistungen in den verbindlichen Teil der Honorarordnung für Architekten und Ingenieure"
"11-2013-049","11","2013","PE 6 - 049/13","A","Handelsübereinkommen EU - Kolumbien/Peru"
"11-2013-047","11","2013","PE 6 - 047/13","A","Freihandelsabkommen zwischen der EU einerseits und Kolumbien und Peru andererseits"
"11-2013-046","11","2013","PE 6 - 046/13","A","Gesetzes- und Verfassungsänderungen in Ungarn seit 2010 aus Sicht des Rechts der Europäischen Union"
"11-2013-044","11","2013","PE 6 - 044/13","A","Zypern-Hilfe - Anwendbare Regeln und Verfahren"
"11-2013-040","11","2013","PE 6 - 040/13","A","Exportverbot für Arzneimittel durch Griechenland"
"11-2013-039","11","2013","PE 6 - 039/13","A","Unionsrechtliche Bewertung einer möglichen Beteiligung des Freistaates Bayern an dem GBW AG-Veräußerungsverfahren der BayernLB"
"11-2013-038","11","2013","PE 6 - 038/13","A","Fragen zu den Vereinbarungen über einen finanziellen Beistand für die Republik Zypern"
"11-2013-033","11","2013","PE 6 - 033/13","A","Die Revision der Tabakproduktrichtline - Kompetenzgrundlage Vereinbarkeit mit dem Grundgesetz und europäischen Grundrechten"
"11-2013-029","11","2013","PE 6 - 029/13","A","Die Netzentgeltbefreiung nach StromNEV und das EEG im Lichte des EU-Beihilfenrechts"
"11-2013-024","11","2013","PE 6 - 024/13","A","Modifikation der Übergangsregelungen betreffend die Anwendung der Arbeitnehmerfreizügigkeit auf bulgarische und rumänische Staatsangehörige"
"11-2013-018","11","2013","PE 6 - 018/13","A","Grundlegende Rechtsprechung des EuGH im Bereich der Wirtschafts- und Sozialpolitik - Auswahl"
"11-2013-016","11","2013","PE 6 - 016/13","A","Zur Vereinbarkeit des Vorschlags der Kommission zur Änderung der Richtlinie zur Angleichung der Rechts- und Verwaltungsvorschriften der Mitgliedstaaten über die Herstellung, die Aufmachung und den Verkauf von Tabakerzeugnissen (Tabakproduktionsrichtlinie) mit dem Subsidiaritätsprinzip"
"11-2013-015","11","2013","PE 6 - 015/13","A","Möglichkeiten zur Einführung einer Finanztransaktionssteuer im Falle des Scheiterns der Verhandlungen bei der Durchführung der Verstärkten Zusammenarbeit"
"11-2013-011","11","2013","PE 6 - 011/13","A","EU-Rede des britischen Premierministers David Cameron und Umsetzungsoptionen der darin geäußerten Vorstellungen für eine Reform der EU"
"11-2013-009","11","2013","PE 6 - 009/13","A","Unionsrechtliche Zulässigkeit eines Werbeverbots für Arzneimittelvertreter in Arztpraxen"
"11-2013-005","11","2013","PE 6 - 005/13","AI","Einheitlicher Europäischer Bankenaufsichtsmechanismus (EAM) - Von den Vorschlägen der Kornmission zur politischen Einigung im Rat"
"11-2013-004","11","2013","PE 6 - 004/13","A","Zur Vereinbarkeit des Vorschlags der Kornmission zur Neufassung der Tabakproduktrichtlinie mit dem Subsidiaritätsprinzip und dem Grundsatz der Verhältnismäßigkeit"
"11-2013-002","11","2013","PE 6 - 002/13","A","Kennzeichnung von Getränkeverpackungen mit „Einweg“ oder „Mehrweg“"
"11-2013-001","11","2013","PE 6 - 001/13","A","EU-Bankenaufsicht - Zugriff auf Sparkassen und Funktionsweise der Aufsicht"
"11-2012-178","11","2012","WD 11 - 178/12","A","Zur Vereinbarkeit des Vorschlags der Kommission zur Neufassung der Tabakproduktrichtlinie mit dem Subsidiaritätsprinzip"
"11-2012-177","11","2012","WD 11 - 177/12","A","Europäische Bankenaufsicht - Rechtsgrundlage und Trennung von Geldpolitik und Aufsicht"
"11-2012-176","11","2012","WD 11 - 176/12","A","Einsatz von Werkvertragsarbeitnehmern in der Lebensmittelbranche - Vereinbarkeit mit dem europäischen Lebensmittel- und Hygienerecht"
"11-2012-174","11","2012","WD 11 - 174/12","A","Das Urteil des EuGH vom 27. November 2012, RS. C-370/12 (Pringle/Irland u.a.)"
"11-2012-171","11","2012","WD 11 - 171/12","A","EU-rechtliche Zulässigkeit der Pflichtmitgliedschaften in Handwerks- sowie Industrie- und Handelskammern für EU-ausländische Dienstleister"
"11-2012-170","11","2012","WD 11 - 170/12","A","Zur Richtlinie 2006/40/EG über Emissionen aus Klimaanlagen in Kraftfahrzeugen - Rechtsfragen im Zusammenhang mit der Ankündigung der Kommission, keine Vertragsverletzungsverfahren wegen der Nichteinhaltung der Anforderungen der Richtlinie einzuleiten"
"11-2012-167","11","2012","WD 11 - 167/12","A","Wirkungen des Assoziierungsabkommens zwischen der Europäischen Union und Staaten Zentralamerikas sowie des Handelsübereinkommens zwischen der Europäischen Union einerseits und Kolumbien und Peru andererseits auf die Regulierungsvorhaben der EU im Finanzmarktsektor"
"11-2012-166","11","2012","WD 11 - 166/12","A","Vereinbarkeit der Einführung eines fahrscheinlosen ÖPNV mit dem Europarecht"
"11-2012-165","11","2012","WD 11 - 165/12","A","Zur Bankenunion einschließlich einer europäischen Bankenaufsicht durch die Europäische Zentralbank (EZB)"
"11-2012-163","11","2012","WD 11 - 163/12","A","Austritt aus der Europäischen Atomgemeinschaft und rechtliche Konsequenzen für das Rahmenprogramm Forschung und Innovation „Horizon 2020“"
"11-2012-159","11","2012","WD 11 - 159/12","A","Vorsorgekonto als Basisprodukt der staatlich geförderten privaten Altersvorsorge Gesetzgebungskompetenz des Bundes und Vereinbarkeit mit dem europäischen Wettbewerbsrecht"
"11-2012-158","11","2012","WD 11 - 158/12","A","Fragen zur Anwendung der Grundfre}heiten und EU-Regelungen zur Unternehmensbesteuerung und der Besteuerung von Zinserträgen im EWR und der Schweiz"
"11-2012-156","11","2012","WD 11 - 156/12","A","Klagemöglichkeiten der deutschen Bundesbank gegen die EZB vor dem Europäischen Gerichtshof"
"11-2012-154","11","2012","WD 11 - 154/12","A","Auswirkungen der 8. GWB-Novelle auf die Einordnung gesetzlicher Krankenkassen als Unternehmen im Sinne der Art. 101 ff. AEUV"
"11-2012-153","11","2012","WD 11 - 153/12","A","Die unionsrechtliche Zulässigkeit des unbegrenzten Ankaufs von Staatsanleihen durch die Europäische Zentralbank"
"11-2012-149","11","2012","WD 11 - 149/12","A","Europarechtliche Bedenken gegen eine Bankenaufsicht durch die Europäische Zentralbank (EZB)? Zum Vorschlag der Kommission für eine Verordnung des Rates zur Übertragung besonderer Aufgaben im Zusammenhang mit der Aufsicht über Kreditinstitute auf die EZB vom 12. September 2012"
"11-2012-147","11","2012","WD 11 - 147/12","A","Beihilfenrelevanz einer Öffnungsklausel in dem Gesetz über die Bundesanstalt für Immobilienaufgaben"
"11-2012-144","11","2012","WD 11 - 144/12","A","Fragen zu einem etwaigen Ausscheiden Griechenlands aus der Euro-Zone - Rechtliche Rahmenbedingungen für ein Ausscheiden aus der Eurozone und/oder aus der EU"
"11-2012-143","11","2012","WD 11 - 143/12","A","Klagemöglichkeiten gegen Maßnahmen der Europäischen Zentralbank (EZB)"
