"ID","Abteilung","Jahr","Aktenzeichen","Status","Titel"
"03-2010-232","03","2010","WD 3 - 232/10","A","Stellvertretung des Bundestagspräsidenten bei der Wahrnehmung seiner Aufgaben nach dem Parteiengesetz"
"03-2010-230","03","2010","WD 3 - 230/10","A","Fragen zum Handeln der Bundesregierung beim Europäischen Finanzstabilisierungsmechanismus"
"03-2010-221","03","2010","WD 3 - 221/10","A","Zur Entstehungsgeschichte von freiwilligen Aufgaben und Pflichtaufgaben der Kommunen"
"03-2010-217","03","2010","WD 3 - 217/10","A","Nachhaltigkeilsprüfung in der Gesetzesfolgenabschätzung - Ein Überblick über die Regelungen und Verfahren in den Mitgliedstaaten der Europäischen Union und in den Bundesländern - Aktualisierte Fassung (Ergänzt um Zypern)"
"03-2010-216","03","2010","WD 3 - 216/10","A","Anerkennung ausländischer Abschlüsse"
"03-2010-210","03","2010","WD 3 - 210/10","A","Erfordert die Zustimmung eines deutschen Ministers zu dem am 9. Mai 2010 beschlossenen 1-Iilfspaket zur Stabilisierung des Euro eine vorherige Konsultation oder Zustimmung des Deutschen Bundestages?"
"03-2010-209","03","2010","WD 3 - 209/10","A","Freie Meinungsäußerung in der Bundesrepublik Deutschland und den USA im Vergleich"
"03-2010-204","03","2010","WD 3 - 204/10","A","Entwurf eines Gesetzes über die Vertretung von Interessen gegenüber dem Deutschen Bundestag und den Bundesbehörden"
"03-2010-198","03","2010","WD 3 - 198/10","A","Verfassungsrechtliche Maßgaben für die geplante Vergabe von Finanzmitteln an Griechenland"
"03-2010-196","03","2010","WD 3 - 196/10","A","Förderung der Bildungschancen benachteiligter Kinder - Finanzierungsmöglichkeiten des Bundes"
"03-2010-193","03","2010","WD 3 - 193/10","A","Bundesgesetz zum Verbot von Grabsteinen aus Kinderarbeit"
"03-2010-191","03","2010","WD 3 - 191/10","A","Wohnbetreuungsvertragsgesetz und Heimgesetze der Bundesländer"
"03-2010-190","03","2010","WD 3 - 190/10","A","Unter welchen Voraussetzungen ist ein Hilfspaket an Griechenland bestehend aus Hilfen des IWF und bilateralen Finanzhilfen (Darlehen) von Euro-Mitgliedstaten mit dem Grundgesetz vereinbar?"
"03-2010-187","03","2010","WD 3 - 187/10","A","Zulässigkeit der Koppelung der Verlängerung der Laufzeit von Atomkraftwerken an die Einzahlung der Betreiber in einen Fonds (Ergänzung zu 101/10)"
"03-2010-185","03","2010","WD 3 - 185/10","A","Schule und Bundeswehr"
"03-2010-181","03","2010","WD 3 - 181/10","A","Parlamentarische Gesetzgebungsdienste - Ein Überblick über die Unterstützung der Abgeordneten durch die Parlamentsverwaltungen in den USA, Frankreich, Großbritannien, Italien, Portugal, Schweden und Spanien sowie in den deutschen Bundesländern"
"03-2010-180","03","2010","WD 3 - 180/10","A","Fragen zur Endlagerung radioaktiven Abfalls"
"03-2010-178","03","2010","WD 3 - 178/10","A","Neufassung des Bundeswahlgesetzes"
"03-2010-171","03","2010","WD 3 - 171/10","A","Darstellung der Initiative zur Verankerung von Generationengerechtigkeit und Nachhaltigkeit im Grundgesetz"
"03-2010-170","03","2010","WD 3 - 170/10","A","Hessisches Polizeirecht"
"03-2010-166","03","2010","WD 3 - 166/10","A","SGB 11-Neuorganisation - Zum Erfordernis einer 2/3-Mehrheit in den Kommunalparlamenten für den Optionsantrag einer Kommune"
"03-2010-165","03","2010","WD 3 - 165/10","A","Versetzung politischer Beamter in den einstweiligen Ruhestand"
"03-2010-162","03","2010","WD 3 - 162/10","A","Anwendbarkeit der Begleitgesetze zum Lissabon-Vertrag auf das Statut der Europäischen Privatgesellschaft"
"03-2010-153","03","2010","WD 3 - 153/10","A","Rechtsfolgen einer Weitergabe von Daten ohne Einverständnis des Patienten"
"03-2010-150","03","2010","WD 3 - 150/10","A","Maßnahmen der Gefahrenabwehr gegen die Verwendung des Fotos eines von der Schutzstaffel (SS) genutzten Raumes"
"03-2010-149","03","2010","WD 3 - 149/10","A","Die Wissenschaftsfreiheit im Grundgesetz und in der Charta der Grundrechte der Europäischen Union"
"03-2010-148","03","2010","WD 3 - 148/10","A","Waffenkontrolle und Gebührenerhebung"
"03-2010-147","03","2010","WD 3 - 147/10","A","Bundeswehr im Schulunterricht: Praktische Handhabung"
"03-2010-144","03","2010","WD 3 - 144/10","A","Haftung der Kirche in sexuellen Missbrauchsfällen"
"03-2010-143","03","2010","WD 3 - 143/10","A","Sind Finanzhilfen der EU an Griechenland durch deutsche Zustimmungsakte zu den Europäischen Verträgen gedeckt und könnte dies vom Bundesverfassungsgericht überprüft werden?"
"03-2010-142","03","2010","WD 3 - 142/10","A","Baurechtliche Maßnahmen gegen Leerstand"
"03-2010-138","03","2010","WD 3 - 138/10","A","Ist eine Änderung des Atomgesetzes wegen Laufzeitverlängerungen durch den Bundesrat zustimmungspflichtig? Gibt es denkbare Möglichkeiten, die Laufzeiten zu verlängern, die nicht die Zustimmung des Bundesrates benötigen?"
"03-2010-135","03","2010","WD 3 - 135/10","A","Wahlrecht ab 16 Jahren - Regelungen und Erfahrungen"
"03-2010-134","03","2010","WD 3 - 134/10","A","Fragen zur iranischen Staatsangehörigkeit"
"03-2010-125","03","2010","WD 3 - 125/10","A","Das jus soli im internationalen Vergleich"
"03-2010-123","03","2010","WD 3 - 123/10","A","Nationales Stipendienprogramm"
"03-2010-112","03","2010","WD 3 - 112/10","A","Zur Vereinbarkeit eines Kopftuchverbots und eines Burkaverbots mit dem deutschen Recht"
"03-2010-110","03","2010","WD 3 - 110/10","A","Staatsleistungen an die Kirchen und Religionsgemeinschaften"
"03-2010-103","03","2010","WD 3 - 103/10","A","Die Mitwirkung der Bundesländer an der Rechtsetzung der EU"
"03-2010-101","03","2010","WD 3 - 101/10","A","Laufzeitverlängerungen für Atomkraftwerke durch Vertrag, Rechtliche Fragen zur Einrichtung eines Fonds zur Abschöpfung von Gewinnen aus Atomkraftwerken"
"03-2010-100","03","2010","WD 3 - 100/10","A","Vertrauensschutz bei Gesetzesänderungen"
"03-2010-095","03","2010","WD 3 - 095/10","A","Rechtsanwalt als Lobbyist: Verfassungsrechtlicher Schutz der Verschwiegenheit"
"03-2010-094","03","2010","WD 3 - 094/10","A","Registrierungspflicht von Lobbyisten: Ahndung von Verstößen durch den Deutschen Bundestag?"
"03-2010-091","03","2010","WD 3 - 091/10","A","Bundeswehr im Schulunterricht"
"03-2010-086","03","2010","WD 3 - 086/10","A","Gesetz gegen die Verwendung von Grabsteinen aus Kinderarbeit"
"03-2010-083","03","2010","WD 3 - 083/10","A","Erfordert die Verlängerung der Laufzeiten deutscher Kernkraftwerke ein Zustimmungsgesetz im Sinne des Artikel 77 Abs. 2a GG?"
"03-2010-081","03","2010","WD 3 - 081/10","A","Maßnahmen der Gefahrenabwehr gegen den Betrieb von „Thor Steinar“-Verkaufsstätten?"
"03-2010-080","03","2010","WD 3 - 080/10","A","Die Beseitigung des negativen Stimmgewichts im Wahlrecht"
"03-2010-078","03","2010","WD 3 - 078/10","A","Verfassungsmäßigkeit des Wissenschaftszeitvertragsgesetzes"
"03-2010-074","03","2010","WD 3 - 074/10","A","Parteispenden von Verbänden"
"03-2010-073","03","2010","WD 3 - 073/10","A","Erweiterung des Untersuchungsauftrages für den Verteidigungsausschuss als Untersuchungsausschuss nach Artikel 45a Abs. 2 GG"
"03-2010-072","03","2010","WD 3 - 072/10","A","Zur Begrenzung der Sitzungszeit im Untersuchungsausschuss"
"03-2010-068","03","2010","WD 3 - 068/10","A","Mitwirkungsrecht des Bundestages bei EU-Beitrittsverhandlungen"
"03-2010-066","03","2010","WD 3 - 066/10","A","Integrationsverträge in Deutschland und im internationalen Vergleich"
"03-2010-063","03","2010","WD 3 - 063/10","A","Zu einem künftigen Gesetz gegen die Verwendung von Grabsteinen aus Kinderarbeit"
"03-2010-060","03","2010","WD 3 - 060/10","A","Gleichstellung eingetragener Lebenspartnerschaften: gemeinschaftliche Adoption eines fremden Kindes"
"03-2010-059","03","2010","WD 3 - 059/10","A","Nachhaltigkeitsprüfung in der Gesetzesfolgenabschätzung - Ein Überblick über die Regelungen und Verfahren in den Mitgliedstaaten der Europäischen Union und in den Bundesländern"
"03-2010-055","03","2010","WD 3 - 055/10","A","Parlamentarische Beiräte"
"03-2010-053","03","2010","WD 3 - 053/10","A","Einsicht in Verträge der öffentlichen Hand"
"03-2010-050","03","2010","WD 3 - 050/10","A","Sozialgesetzbuch II: Möglichkeiten der Umgestaltung der Arbeitsgemeinschaften - Verfassungsrechtliche Grenzen nach dem Urteil des Bundesverfassungsgerichts"
"03-2010-046","03","2010","WD 3 - 046/10","A","Das Tragen einer Burka im öffentlichen Raum "
"03-2010-042","03","2010","WD 3 - 042/10","A","Parlamentarisches Frage- und Zitierrecht der Landtage"
"03-2010-037","03","2010","WD 3 - 037/10","A","Formelles parlamentarisches Fragerecht in ausgewählten europäischen und nordamerikanischen Ländern"
"03-2010-028","03","2010","WD 3 - 028/10","A","Stiftungsrat der Stiftung „Flucht, Vertreibung, Versöhnung“, Gründe für die Ablehnung einer benannten Person"
"03-2010-023","03","2010","WD 3 - 023/10","A","Minarett-, Burka- und Kopftuchverbote in europäischen Staaten"
"03-2010-020","03","2010","WD 3 - 020/10","A","Richtervorbehalt bei der Entnahme von Blutproben nach§ 81a der Strafprozessordnung"
"03-2010-012","03","2010","WD 3 - 012/10","A","Fragen zum Bestattungsrecht"
"03-2010-011","03","2010","WD 3 - 011/10","A","Rechtsfragen des Fraktionsstatus"
"03-2010-008","03","2010","WD 3 - 008/10","A","Staatlicher Schutz der Bevölkerung vor Gefahren durch ABC-Waffen, Vorbereitung für die Teilnahme an einer Podiumsdiskussion"
"03-2010-007","03","2010","WD 3 - 007/10","A","Herstellung von Einvernehmen nach § 10 Abs. 2 Satz 1 EUZBBG"
"03-2010-005","03","2010","WD 3 - 005/10","A","Stasiüberprüfung und Beamtenstatutsgesetz"
"03-2010-001","03","2010","WD 3 - 001/10","A","Formen der unabhängigen Erledigung von staatlichen Verwaltungsaufgaben"
"03-2009-464","03","2009","WD 3 - 464/09","A","Öffentlichkeit im Verteidigungsausschuss als Untersuchungsausschuss"
"03-2009-462","03","2009","WD 3 - 462/09","A","Auslegung von § 10 Abs. 2 des Gesetzes über die Zusammenarbeit von Bundesregierung und Deutschem Bundestag in Angelegenheiten der Europäischen Union"
"03-2009-459","03","2009","WD 3 - 459/09","A","Gleichstellung eingetragener Lebenspartner: Auswirkung der Rechtsprechung des BVerfG und des EuGH auf Landes- und Satzungsrecht"
"03-2009-451","03","2009","WD 3 - 451/09","A","Gesetzgebungskompetenz für das Energieleitungsausbaugesetz"
"03-2009-449","03","2009","WD 3 - 449/09","A","Gleichstellung verpartneter Beamter: Rückwirkender Anspruch auf Leistungen?"
"03-2009-448","03","2009","WD 3 - 448/09","A","Mitwirkung des Bundestages bei EU-Beitrittsverhandlungen"
"03-2009-447","03","2009","WD 3 - 447/09","A","Gleichstellung eingetragener Lebenspartner: Rückwirkender Anspruch auf Leistungen?"
"03-2009-444","03","2009","WD 3 - 444/09","A","Minarettverbot in der Schweiz - Hier: Verletzte ein Verbot, Minarette zu errichten, die Religionsfreiheit nach Artikel 4 GG?"
"03-2009-436","03","2009","WD 3 - 436/09","A","Formelles parlamentarisches Fragerecht in ausgewählten europäischen Ländern"
"03-2009-431","03","2009","WD 3 - 431/09","A","Mitwirkung des Bundestages beim Abschluss internationaler Abkommen durch die Union gern, Vertrag von Lissabon?"
"03-2009-429","03","2009","WD 3 - 429/09","AI","Gleichstellung eingetragener Lebenspartnerschaften: Zu den Auswirkungen der Entscheidung des Bundesverfassungsgerichts zur Hinterbliebenenrente"
"03-2009-425","03","2009","WD 3 - 425/09","A","Verhältnis zwischen Bundes- und Landesrecht zur Energieinfrastruktur; hier: Energieleitungsausbaugesetz und niedersächsisches Erdkabelgesetz"
"03-2009-421","03","2009","WD 3 - 421/09","A","Entwicklungen im Wahlrecht des Bundes"
"03-2009-417","03","2009","WD 3 - 417/09","A","Terrorismus: Definitionen, Rechtsgrundlagen und Maßnahmen zur Terrorismusbekämpfung"
"03-2009-414","03","2009","WD 3 - 414/09","A","Gleichstellung eingetragener Lebenspartnerschaften: Zu den Auswirkungen der Entscheidung des Bundesverfassungsgerichts zur Hinterbliebenenrente"
"03-2009-412","03","2009","WD 3 - 412/09","A","Der Zoll in Deutschland, Frankreich, Italien, Schweiz und Spanien"
"03-2009-409","03","2009","WD 3 - 409/09","A","„Gelbe Karte“ bei Personen mit hohem Aggressionspotential"
"03-2009-406","03","2009","WD 3 - 406/09","AI","Parlamentarisches Fragerecht der Landtage (Infobrief)"
"03-2009-397","03","2009","WD 3 - 397/09","A","Auswirkung der Hamburger Schulstrukturreform auf Schulen in freier Trägerschaft"
"03-2009-392","03","2009","WD 3 - 392/09","A","Differenzierung bei der Auszahlung von Betreuungsgeld"
"03-2009-391","03","2009","WD 3 - 391/09","A","Gleichstellung eingetragener Lebenspartnerschaften: Die Entscheidung des Bundesverfassungsgerichts zur Hinterbliebenenrente"
"03-2009-388","03","2009","WD 3 - 388/09","A","Nationale Plebiszite in der EU, den USA, Kanada und der Schweiz"
"03-2009-384","03","2009","WD 3 - 384/09","A","Parlamentarisches Fragerecht der Landtage"
"03-2009-381","03","2009","WD 3 - 381/09","AI","60 Jahre Grundgesetz - Zahlen und Fakten - Aktualisierung"
"03-2009-380","03","2009","WD 3 - 380/09","AI","Änderungen des Grundgesetzes seit 1949 - Aktualisierung"
"03-2009-375","03","2009","WD 3 - 375/09","A","Grundgesetz a. D.?"
"03-2009-370","03","2009","WD 3 - 370/09","A","Überprüfung von Wahlergebnissen"
"03-2009-362","03","2009","WD 3 - 362/09","A","Auswirkungen des Lissabon-Urteils auf den Bundesrat"
"03-2009-358","03","2009","WD 3 - 358/09","A","Prüfung der Korruptionsrelevanz im Gesetzgebungsverfahren"
"03-2009-357","03","2009","WD 3 - 357/09","A","Aufstellung politischer Ämter auf allen politischen Ebenen"
"03-2009-349","03","2009","WD 3 - 349/09","A","Rechtslage für die Arbeitsaufnahme australischer Staatsangehöriger in Deutschland"
"03-2009-348","03","2009","WD 3 - 348/09","AI","Die Verfassungen der Mitgliedstaaten der Europäischen Union - ungeprüfte Internetrecherche"
"03-2009-341","03","2009","WD 3 - 341/09","A","EU-Antidiskriminierungsrichtlinien und nationale Stellen in den EU-Mitgliedstaaten"
"03-2009-339","03","2009","WD 3 - 339/09","A","Die nationalen Antidiskriminierungsstellen in den Mitgliedstaaten der Europäischen Union"
"03-2009-325","03","2009","WD 3 - 325/09","A","Verbot der Aufstellung von Wahlplakaten und Zulässigkeit von Gebühren für das Aufstellen von Wahlplakaten im Wahlkampf"
"03-2009-321","03","2009","WD 3 - 321/09","AI","Auswirkungen der Föderalismusreform I"
"03-2009-301","03","2009","WD 3 - 301/09","A","Erforderlichkeit einer Änderung des Grundgesetzes im Hinblick auf die vom Bundesverfassungsgericht geforderte Bindungswirkung von Stellungnahmen des Deutschen Bundestages"
"03-2009-297","03","2009","WD 3 - 297/09","A","Verfassungsgrundsätze - Die Absicherung des Demokratieprinzips und des Sozialstaatsprinzips durch die Rechtsprechung des Bundesverfassungsgerichts"
"03-2009-286","03","2009","WD 3 - 286/09","A","Verfassungsrechtlicher Rahmen zur Neuorganisation der Aufgabenwahrnehmung nach dem Sozialgesetzbuch II"
"03-2009-282","03","2009","WD 3 - 282/09","A","Zur Anbringung eines Vorbehalts zum Vertrag von Lissabon"
"03-2009-277","03","2009","WD 3 - 277/09","A","Entwurf eines Begleitgesetzes zum Vertrag von Lissabon (3. Variante: Entwurf eines Begleitgesetzes und eines Unterrichtungsgesetzes)"
"03-2009-266","03","2009","WD 3 - 266/09","A","Abgrenzung zwischen Tatsachenbehauptung und Werturteil im Rahmen des Art. 5 Abs. 1 GG"
"03-2009-264","03","2009","WD 3 - 264/09","A","Bürgerforen in Deutschland"
"03-2009-255","03","2009","WD 3 - 255/09","A","Auswirkungen der Föderalismusreform I - Mitwirkungsrechte und Gesetzgebungskompetenzen"
"03-2009-250","03","2009","WD 3 - 250/09","A","Bindungswirkung von Voten des Petitionsausschusses"
"03-2009-247","03","2009","WD 3 - 247/09","A","Das Urteil des Bundesverfassungsgerichts zum Vertrag von Lissabon"
"03-2009-237","03","2009","WD 3 - 237/09","A","Volksbegehren, Volksentscheid, Volksabstimmung: Begrifflichkeiten und Modelle"
"03-2009-232","03","2009","WD 3 - 232/09","A","Entwurf eines Gesetzes über die Vertretung von Interessen gegenüber dem Deutschen Bundestag und den Bundesbehörden - Modifizierte Fassung vom 25. Juni 2009"
"03-2009-231","03","2009","WD 3 - 231/09","A","Musterentwurf eines Umweltschadenskostengesetzes"
"03-2009-230","03","2009","WD 3 - 230/09","A","Zu Aufgabe und Unabhängigkeit der Antidiskriminierungsstelle des Bundes und der entsprechenden nationalen Stellen in anderen EU-Mitgliedstaaten"
"03-2009-227","03","2009","WD 3 - 227/09","A","Zu Aufgaben und Unabhängigkeit der Antidiskriminierungsstellen in den anderen EU-Mitgliedstaaten"
"03-2009-225","03","2009","WD 3 - 225/09","A","Staatliche Finanzierung der Parlamentsfraktionen"
"03-2009-220","03","2009","WD 3 - 220/09","A","Zur Mitwirkung des Bundestages an der Verordnungsgebung"
"03-2009-213","03","2009","WD 3 - 213/09","A","Zum Aufenthaltsrecht von Bürgern anderer EU-Mitgliedstaaten in Deutschland sowie ihrem Anspruch auf Sozialleistungen"
"03-2009-211","03","2009","WD 3 - 211/09","A","Zulässigkeit des Versendens von sog. „Abuse E-Mails“ durch das Bundeskriminalamt an außereuropäische Host-Provider"
"03-2009-206","03","2009","WD 3 - 206/09","A","Rechtliche Möglichkeiten von Internet-Parteiverbänden "
"03-2009-200","03","2009","WD 3 - 200/09","A","Aufgaben und Rechtsstellung der Landesbeauftragten für die Unterlagen des Staatssicherheitsdienstes der Deutschen Demokratischen Republik"
"03-2009-197","03","2009","WD 3 - 197/09","A","Sondernutzungsgebühren für Wahlwerbung"
"03-2009-189","03","2009","WD 3 - 189/09","A","Öffentlichkeitsgrundsatz der Beweisaufnahme und Geheimnisschutz im Untersuchungsausschuss - Zur Reichweite einer Aussagegenehmigung bei besonderen"
"03-2009-188","03","2009","WD 3 - 188/09","A","Rechtliche Möglichkeiten einer Stadtverwaltung eine „Killerspiel“-Veranstaltung zu verbieten"
"03-2009-183","03","2009","WD 3 - 183/09","A","Waffenrecht für Bundespolizei und GSG 9 sowie Bundeswehr und KSK"
"03-2009-182","03","2009","WD 3 - 182/09","A","Zur Bekämpfung der Piraterie - Völkerrecht, Staatsrecht, Strafrecht"
"03-2009-181","03","2009","WD 3 - 181/09","A","60 Jahre Grundgesetz - Zahlen und Fakten"
"03-2009-167","03","2009","WD 3 - 167/09","A","Behandlung von Ausschussunterlagen"
"03-2009-163","03","2009","WD 3 - 163/09","A","Entlassung aus der türkischen Staatsbürgerschaft für Wehrpflichtige"
"03-2009-156","03","2009","WD 3 - 156/09","A","Rechtliche Rahmenbedingungen für die Bewältigung biologischer Gefahrenlagen"
"03-2009-151","03","2009","WD 3 - 151/09","A","Fragen zur DDR-Verfassung im Vergleich mit dem Grundgesetz"
"03-2009-147","03","2009","WD 3 - 147/09","A","Sunset Legislation"
"03-2009-146","03","2009","WD 3 - 146/09","A","Elektronische Verkündung von Rechtsnormen"
"03-2009-144","03","2009","WD 3 - 144/09","A","Änderungen des Grundgesetzes seit 1949 - Inhalt, Datum, Abstimmungsergebnis und Textvergleich"
"03-2009-135","03","2009","WD 3 - 135/09","A","Volksabstimmung in Deutschland über den Vertrag von Lissabon"
"03-2009-126","03","2009","WD 3 - 126/09","A","Kompetenzen des Bundes im Bereich des Bildungswesens - Handlungsoptionen für eine gesamtstaatliche Bildungspolitik"
"03-2009-123","03","2009","WD 3 - 123/09","A","Änderungshistorie einschlägiger Regelungen zum Datenschutz von Ausländern seit 1998"
"03-2009-107","03","2009","WD 3 - 107/09","A","Sozialgesetzbuch II - Alleinige Wahrnehmung der Aufgaben durch die Kommunen"
"03-2009-101","03","2009","WD 3 - 101/09","A","Reform des SGB II"
"03-2009-095","03","2009","WD 3 - 095/09","A","Geheimhaltung von amtlichen Unterlagen"
"03-2009-083","03","2009","WD 3 - 083/09","A","Aktueller Stand der beim Bundesverfassungsgericht anhängigen Klagen zum Zustimmungsgesetz zum Vertrag von Lissabon"
"03-2009-081","03","2009","WD 3 - 081/09","A","Verfassungsmäßigkeit einer Schuldenbegrenzungsregel im Grundgesetz für die Bundesländer"
"03-2009-077","03","2009","WD 3 - 077/09","AI","Die Regierungssysteme der EU-Mitgliedstaaten - Auswertung und Analyse der Verfassungen der Mitgliedstaaten"
"03-2009-076","03","2009","WD 3 - 076/09","AI","Lärmschutz bei Sportanlagen, Kindertagesstätten und Spielplätzen"
"03-2009-075","03","2009","WD 3 - 075/09","A","Verstößt § 6 Abs. 1 Arbeitsschutzgesetz gegen Richtlinie 89/391/EWG?"
"03-2009-074","03","2009","WD 3 - 074/09","A","Vom Anwerbestopp zum Zuwanderungsgesetz"
"03-2009-073","03","2009","WD 3 - 073/09","A","Regelung der Beförderungsbedingungen der. Deutschen Bahn"
"03-2009-069","03","2009","WD 3 - 069/09","A","Umsetzung völkerrechtlicher Verträge"
"03-2009-068","03","2009","WD 3 - 068/09","A","Wahlen zum Europäischen Parlament"
"03-2009-067","03","2009","WD 3 - 067/09","A","Kriterien für die Anerkennung nationaler Minderheiten"
"03-2009-059","03","2009","WD 3 - 059/09","A","Einzelfragen zur Novellierung des Bundesdatenschutzgesetzes "
"03-2009-054","03","2009","WD 3 - 054/09","A","Regionalisierung und kommunale Handlungsfähigkeit"
"03-2009-051","03","2009","WD 3 - 051/09","A","Ausnahmeregelungen für Parteien nationaler Minderheiten bei der Wahl zum Deutschen Bundestag - Teil I"
"03-2009-045","03","2009","WD 3 - 045/09","A","Wahlrechtsänderungen"
"03-2009-041","03","2009","WD 3 - 041/09","A","Lotterie/Sportwelten"
"03-2009-040","03","2009","WD 3 - 040/09","A","Betreuungsgeld und Integration"
"03-2009-035","03","2009","WD 3 - 035/09","A","Länderneuordnung"
"03-2009-032","03","2009","WD 3 - 032/09","A","Einführung einer allgemeinen „Vorschulpflicht“"
"03-2009-025","03","2009","WD 3 - 025/09","A","Raucherkabinen in den Liegenschaften des Deutschen Bundestages"
"03-2009-024","03","2009","WD 3 - 024/09","A","Negatives Stimmgewicht im Wahlrecht"
"03-2009-013","03","2009","WD 3 - 013/09","A","Auflösung des Parlaments in Deutschland, Frankreich,"
"03-2009-009","03","2009","WD 3 - 009/09","A","Aufnahme von Guatanamo-Häftlingen, Rechtliche Voraussetzungen"
"03-2008-471","03","2008","WD 3 - 471/08","A","Verfassungsrechtliche Begründung für eine Beschränkung der Reichweite von Patientenverfügungen - aktualisierte Fassung von WD 3 - 212/06"
"03-2008-469","03","2008","WD 3 - 469/08","A","Änderung des Erneuerbare-Energien-Gesetzes: Altanlagen"
"03-2008-467","03","2008","WD 3 - 467/08","A","Kirchenbaulasten und Einigungsvertrag"
"03-2008-461","03","2008","WD 3 - 461/08","A","Die Mitwirkung des Bundestages an der Rechtsetzung der Europäischen Union"
"03-2008-460","03","2008","WD 3 - 460/08","A","Verfassungsrechtliche Rahmenbedingungen einer Gemeinsamen Bildungskonferenz"
"03-2008-452","03","2008","WD 3 - 452/08","A","Begriff der „Familie“ nach Art. 6 Abs. 1 GG; Besteuerung von Erben zweiter Ordnung"
"03-2008-449","03","2008","WD 3 - 449/08","A","Voraussetzungen und Folgen der Inanspruchnahme von „Sabbat- Zeiten“ und Erfahrungen im öffentlichen Dienst"
"03-2008-447","03","2008","WD 3 - 447/08","A","Maritime Sicherheitslage Deutschlands unter besonderer Berücksichtigung der Zuständigkeit von Bund und Ländern"
"03-2008-443","03","2008","WD 3 - 443/08","A","Finanzverfassung und europäisches Vergaberecht: Art. 106a'GG"
"03-2008-439","03","2008","WD 3 - 439/08","A","Verbot von Grabsteinen aus Kinderarbeit und Verfassungsrecht"
"03-2008-438","03","2008","WD 3 - 438/08","A","Verstöße von Ärzten gegen § 96 Aufenthaltsgesetz:'Kompetenzen der Länder"
"03-2008-433","03","2008","WD 3 - 433/08","A","Zur Möglichkeit der Finanzierung von Frauenhäusern durch den Bund - Nachfrage zu 060/08"
"03-2008-429","03","2008","WD 3 - 429/08","A","Zu einem neuen Wahlrecht"
"03-2008-426","03","2008","WD 3 - 426/08","A","Inpflichtnahme Privater für die öffentliche Sicherheit am Beispiel der Luftsicherheitsgebühr"
"03-2008-425","03","2008","WD 3 - 425/08","A","Zur Regelung neuer Pflichten bei medizinisch indiziertem Schwangerschaftsabbruch"
"03-2008-423","03","2008","WD 3 - 423/08","A","Regelung der Überprüfung von Wahlbewerbern in Kommunalwahlgesetzen"
"03-2008-422","03","2008","WD 3 - 422/08","A","Kommunale Gebietsreform in Niedersachsen und Mecklenburg-Vorpommern"
"03-2008-416","03","2008","WD 3 - 416/08","A","NATO-Truppenstatut, Zusatzabkommen, Verwaltungsvereinbarungen"
"03-2008-408","03","2008","WD 3 - 408/08","A","Zum Entwurf eines Lobbyismus-Gesetzes"
"03-2008-406","03","2008","WD 3 - 406/08","A","Scharia und Grundrechte von Frauen in der Bundesrepublik"
"03-2008-404","03","2008","WD 3 - 404/08","A","Aufstellung von Listenkandidaten einer Partei"
"03-2008-395","03","2008","WD 3 - 395/08","A","Bündelung der Telekommunikationsüberwachung"
"03-2008-385","03","2008","WD 3 - 385/08","A","Gesetzgebungskompetenzen im Jagdrecht"
"03-2008-374","03","2008","WD 3 - 374/08","A","Zur „Verstaatlichung“ von Kreditinstituten"
"03-2008-369","03","2008","WD 3 - 369/08","A","Mögliche Folgen einer Abschaffung des Anschluss- und Benutzungszwangs"
"03-2008-367","03","2008","WD 3 - 367/08","AI","Bundesbeauftragte und Beauftragte der Bundesregierung"
"03-2008-365","03","2008","WD 3 - 365/08","A","Zur Eingliederung von Beamten in die gesetzliche Rentenversicherung"
"03-2008-352","03","2008","WD 3 - 352/08","A","Bundesbeauftragte und Beauftragte der Bundesregierung"
"03-2008-346","03","2008","WD 3 - 346/08","A","Status, Aufgaben und Organisation des Bundesamtes für Strahlenschutz"
"03-2008-335","03","2008","WD 3 - 335/08","A","Einzelfragen zu Datensicherheit und Datenschutz"
"03-2008-328","03","2008","WD 3 - 328/08","AI","Leistungen an die Mitglieder des Deutschen Bundestages und der Landesparlamente"
"03-2008-325","03","2008","WD 3 - 325/08","A","Gesetzgebungskompetenz für den Erlass von Mindestlöhnen"
"03-2008-321","03","2008","WD 3 - 321/08","A","Die Finanzierung der Feuerwehr in den Bundesländern"
"03-2008-317","03","2008","WD 3 - 317/08","A","Datenschutzrechtliche Regelungen im Bereich der Geschäftstätigkeit von Banken und Sparkassen"
"03-2008-313","03","2008","WD 3 - 313/08","A","Weisungsbefugnisse des Bundesministers für Verkehr, Bau und Stadtentwicklung gegenüber dem Eisenbahn-Bundesamt"
"03-2008-299","03","2008","WD 3 - 299/08","A","Werbeverbot für Schlankheitsmittel"
