"ID","Abteilung","Jahr","Aktenzeichen","Status","Titel"
"09-2009-100","09","2009","WD 9 - 100/09","A","Impfstrategie in der Bundesrepublik Deutschland zur Bekämpfung der Ausbreitung der Neuen Influenza A(H1N1) im Pandemiefall"
"09-2009-092","09","2009","WD 9 - 092/09","A","Beitragsbemessung für freiwillig Krankenversicherte mit niedrigem Einkommen"
"09-2009-087","09","2009","WD 9 - 087/09","A","Begriff, Rechtsformen und Finanzierung der Universitätskliniken in Deutschland"
"09-2009-045","09","2009","WD 9 - 045/09","A","Bundes- und landesrechtliche Voraussetzungen zur Erteilung einer Betriebserlaubnis für privat-gewerbliche Träger von Kindertageseinrichtungen"
"09-2009-041","09","2009","WD 9 - 041/09","A","Landesrechtliche Regelungen zur öffentlichen Förderung privat-gewerblicher Träger von Kindertageseinrichtungen"
"09-2009-038","09","2009","WD 9 - 038/09","A","Gleichstellung von Männern und Frauen in Deutschland (aktualisierte Fassung von Auftrag WD 9 - 085/07 für Dossier)"
"09-2009-037","09","2009","WD 9 - 037/09","A","Medien- und Computerspielsucht"
"09-2009-034","09","2009","WD 9 - 034/09","A","Vergütung von Kassenärzten"
"09-2009-032","09","2009","WD 9 - 032/09","A","Zur Frage der Anerkennung privat-gewerblicher Träger von Kindertageseinrichtungn als Träger der freien Jugendhilfe nach Bundes- und Landesrecht"
"09-2009-023","09","2009","WD 9 - 023/09","A","Rechtsfragen zur An- oder Aufhebung der Beitragsbemessungsgrenze in der gesetzlichen Kranken- und Pflegeversicherung"
"09-2009-016","09","2009","WD 9 - 016/09","A","Jodversorgung und Jodmangel in Deutschland"
"09-2009-014","09","2009","WD 9 - 014/09","A","Rechtliche Grundlagen der heroingestützten Behandlung von Drogenabhängigen in der Schweiz"
"09-2009-011","09","2009","WD 9 - 011/09","A","Anwendung der Ruhensvorschriften des § 16 Abs. 3a Satz 2 SGB V auf familienversicherte Angehörige"
"09-2008-154","09","2008","WD 9 - 154/08","A","Politische Erwartungen an die Einführung des Gesundheitsfonds"
"09-2008-152","09","2008","WD 9 - 152/08","A","Voraussetzung der Versicherung in einer gesetzlichen Krankenkasse unter dem besonderen Aspekt der zuvor hauptberuflich selbständigen Erwerbstätigkeit im Ausland"
"09-2008-147","09","2008","WD 9 - 147/08","A","Gesetzliche Änderungen in den einzelnen Bundesländern im Bereich der Kinder- und Jugendhilfe aufgrund der Föderalismusreform"
"09-2008-133","09","2008","WD 9 - 133/08","A","Forschungsstand zur Jugendgewalt"
"09-2008-128","09","2008","WD 9 - 128/08","A","„Legasthenie und Dyskalkulie“"
"09-2008-122","09","2008","WD 9 - 122/08","A","Einzelfragen zum PsychKG"
"09-2008-121","09","2008","WD 9 - 121/08","A","Die UN Disability Convention und deren Auswirkungen auf die Zwangsunterbringung und -behandlung nach dem PsychKG"
"09-2008-091","09","2008","WD 9 - 091/08","A","Rechtliche Ungleichbehandlung zwischen Zivildienstleistenden und Personen, die einen Jugendfreiwilligendienst nach § 14c Zivildienstgesetz ableisten"
"09-2008-077","09","2008","WD 9 - 077/08","A","Europäische Vorgaben und ihre mögliche Wirkung auf die Kinder- und Jugendhilfe"
"09-2008-076","09","2008","WD 9 - 076/08","A","Die Kosten-Nutzen-Bewertung von Arzneimitteln als Rechtsproblem"
"09-2008-075","09","2008","WD 9 - 075/08","A","Krankenversicherungsschutz ehrenamtlich Tätiger im Ausland am Beispiel der Entwicklungsorganisation „Helfende Hände e.V.“ - Humanitäre Hilfe für Mauretanien und die Dritte Welt"
"09-2008-073","09","2008","WD 9 - 073/08","A","Rechtsstatus und Anspruch auf Sonderzuwendungen während der Elternzeit"
"09-2008-071","09","2008","WD 9 - 071/08","A","Möglichkeiten „anonymer Geburt“ in Frankreich Rechtliche Regelungen, Erfahrungswerte, statistische Angaben"
"09-2008-058","09","2008","WD 9 - 058/08","A","Anrechnung von Kindergeld auf das Pflegegeld bei Vollzeitpflege nach dem SGB VIII"
"09-2008-053","09","2008","WD 9 - 053/08","A","Fragen zu Leistungen der sozialen Pflegeversicherung im Rahmen eines trägerübergreifenden Persönlichen Budgets bei Aufenthalt in einem Mitgliedstaat der EU"
"09-2008-052","09","2008","WD 9 - 052/08","A","Einzelfragen zu ausgewählten sozialrechtlichen Aspekten bei Aufenthalt in einem Mitgliedsstaat der EU sowie zur UN-Konvention über die Rechte von Menschen mit Behinderungen"
"09-2008-002","09","2008","WD 9 - 002/08","A","Förderung der gesundheitsbezogenen Selbsthilfe durch die öffentliche Hand und die Sozialversicherungsträger - Rechtsgrundlagen und Förderpraxis"
"09-2008-001","09","2008","WD 9 - 001/08","A","Mitversicherung von in der Türkei oder den Westbalkan-Staaten lebenden Familienangehörigen im Krankheitsfall"
"09-2007-141","09","2007","WD 9 - 141/07","A","Gesetzliche Krankenversicherung von Studenten"
"09-2007-130","09","2007","WD 9 - 130/07","A","Qualitätssicherung und Transparenz im Rahmen der Gesundheitsreform unter besonderer Berücksichtigung des Datenschutzes"
"09-2007-109","09","2007","WD 9 - 109/07","A","Standards der Ausbildung für Pflegekräfte"
"09-2007-102","09","2007","WD 9 - 102/07","A","Wettbewerb zwischen den gesetzlichen Krankenkassen"
"09-2007-085","09","2007","WD 9 - 085/07","A","Gleichstellung von Männern und Frauen in Deutschland"
"09-2007-070","09","2007","WD 9 - 070/07","A","Strukturmerkmale und Regelungsformen in der Prävention"
"09-2007-069","09","2007","WD 9 - 069/07","A","Präventionsmaßnahmen der gesetzlichen Krankenkassen"
"09-2007-061","09","2007","WD 9 - 061/07","A","Soziale Marktwirtschaft und Gesundheitswesen"
"09-2007-060","09","2007","WD 9 - 060/07","A","Die Wirkung von Musik auf die Persönlichkeitsentwicklung von Kindern"
"09-2007-034","09","2007","WD 9 - 034/07","A","Forderungen zur Verhinderung von Missbräuchen im Bereich der Schönheitschirurgie"
"09-2007-008","09","2007","WD 9 - 008/07","A","Leistungseinschränkungen und -ausschlüsse in der Arzneimittelversorgung seit Inkrafttreten des Gesundheits- Reformgesetzes (GRG) am 1. Januar 1989"
"09-2006-223","09","2006","WD 9 - 223/06","A","Führt die Nutzung gewaltdarstellender Computerspiele zu Aggressionen?"
"09-2006-209","09","2006","WD 9 - 209/06","A","Arbeitgeberanteil zur Krankenversicherung als vorenthaltener Lohn"
"09-2006-205","09","2006","WD 9 - 205/06","A","Die Berücksichtigung von Ehegatten, eingetragenen Lebenspartnern und Partnern sonstiger nichtehelicher Lebensgemeinschaften in der gesetzlichen Kranken- und Pflegeversicherung"
"09-2006-202","09","2006","WD 9 - 202/06","A","Alkoholabhängigkeit"
"09-2006-168","09","2006","WD 9 - 168/06","AI","Übersicht über Maßnahmen zum Schutz und zur Förderung von Frauen auf Bundesebene"
"09-2006-158","09","2006","WD 9 - 158/06","A","Höchstaltersgrenzen für die Berufsausübung von Ärzten, Zahnärzten und Psychotherapeuten in bundesrechtlichen Regelungen - Derzeitiger Stand und Reformbemühungen"
"09-2006-143","09","2006","WD 9 - 143/06","A","Familienkassen in ausgewählten europäischen Ländern"
"09-2006-067","09","2006","WD 9 - 067/06","A","Gleichstellung von Männern und Frauen in Norwegen und Deutschland"
"09-2006-035","09","2006","WD 9 - 035/06","A","Aktuelle Übersicht über familienfördernde Maßnahmen in Deutschland: - allgemeine Maßnahmen / - Maßnahmen im Rahmen des Familienleistungsausgleichs / - steuerliche Maßnahmen"
"09-2006-023","09","2006","WD 9 - 023/06","A","Wertschöpfungssteuer als alternative Finanzierung der gesetzlichen Krankenversicherung"
"09-2006-010","09","2006","WD 9 - 010/06","A","Betreuungseinrichtungen in Berlin und Brandenburg: Kinder-, Alten-, Pflege-, Behinderteneinrichtungen, Hospize: Träger, Versorgungslage, Versorgungslücken, Finanzierung, Förderungen."
"09-2006-009","09","2006","WD 9 - 009/06","A","System der amerikanischen Krankenhäuser"
"09-2006-005","09","2006","WD 9 - 005/06","A","Arzneimittel in der integrierten Versorgung"
"09-2006-004","09","2006","WD 9 - 004/06","A","Kurzdarstellung der Gesetzgebung zur Pflegeversicherung"
"09-2005-153","09","2005","WF IX G - 153/05","A","Ärztliche Einschulungsuntersuchungen - Rechtslage in Deutschland"
"09-2005-150","09","2005","WF IX G - 150/05","A","Aufhebung der Beitragsbemessungsgrenze im Kapitalsteuer-Modell der Bürgerversicherung"
"09-2005-148","09","2005","WF IX G - 148/05","A","Ärztliche Vorsorgeuntersuchungen für Kinder sowie ärztliche Untersuchungen im Rahmen der Aufnahme von Kindern in Tageseinrichtungen - Rechtslage in Deutschland"
"09-2005-135","09","2005","WF IX G - 135/05","A","Kosteninfrastruktur Kindertagesbetreuung Deutschland"
"09-2005-130","09","2005","WF IX G - 130/05","A","Grundinformationen zum privatärztlichen Gebührenrecht nach der Gebührenordnung für Ärzte (GOÄ) (Zuarbeit FB III)"
"08-2015-046","08","2015","WD 8 - 046/15","A","Zur Berufsbildungsstelle See, Bremen"
"08-2015-033","08","2015","WD 8 - 033/15","A","Zu Umweltstandards in Kanada, den USA und der EU"
"08-2015-028","08","2015","WD 8 - 028/15","A","Biologisch abbaubare Kunststoffe"
"08-2015-003","08","2015","WD 8 - 003/15","A","Interparlamentarisches Treffen - Ausschuss für die Rechte der Frau und Gleichstellung der Geschlechter (FEMM) des Europäischen Parlaments am 5. März in Brüssel"
"08-2014-090","08","2014","WD 8 - 090/14","A","Zum Gebrauch der Deutschen Sprache in der Wissenschaft"
"08-2014-074","08","2014","WD 8 - 074/14","AI","Mülltrennung"
"08-2014-058","08","2014","WD 8 - 058/14","AI","Verschmutzung der Meere durch Mikroplastikpartikel"
"08-2014-036","08","2014","WD 8 - 036/14","A","Wissenschaftliche Zugänge zum Thema Bildungsaufstieg"
"08-2014-032","08","2014","WD 8 - 032/14","A","Vor- und Nachteile verschiedener Energiespeichersysteme"
"08-2014-006","08","2014","WD 8 - 006/14","A","Aspekte der Delphi-Methode"
"08-2013-065","08","2013","WD 8 - 065/13","A","Aktuelle Maßnahmen und Wirkungen der „Bildung für Nachhaltige Entwicklung“ in Deutschland"
"08-2013-060","08","2013","WD 8 - 060/13","A","Vielfalt der Datenlage zum Bildungsaufstieg in Deutschland"
"08-2013-021","08","2013","WD 8 - 021/13","A","Das Konzept der Nachhaltigkeit im Deutschen Bundestag - Chronologie der parlamentarischen Behandlung"
"08-2013-012","08","2013","WD 8 - 012/13","AI","Suchmaschinenindizierung - technische Aspekte im Kontext der Debatte zum Leistungsschutzrecht"
"08-2013-009","08","2013","WD 8 - 009/13","AI","Leistungsschutzrecht - technische Aspekte zur Suchmaschinenindizierung"
"08-2013-007","08","2013","WD 8 - 007/13","A","Flugverfahren, Messtechniken/Messverfahren"
"08-2013-002","08","2013","WD 8 - 002/13","A","Parlamentarische Abläufe zur Präimplantationsdiagnostik - Vom Embryonenschutzgesetz zum Präimplantationsdiagnostikgesetz"
"08-2012-100","08","2012","WD 8 - 100/12","A","CCS-Technologie in Deutschland im Überblick"
"08-2012-093","08","2012","WD 8 - 093/12","A","Arzneimittelrückstände im Wasserkreislauf - Vorkommen, Relevanz und Elimination"
"08-2012-091","08","2012","WD 8 - 091/12","A","CCS-Technologiechronologie/Darstellung des parlamentarischen Verfahrens - CCS: CO2-Abscheidung und -speicherung"
"08-2012-086","08","2012","WD 8 - 086/12","A","Technikpolitik im Deutschen Bundestag"
"08-2012-048","08","2012","WD 8 - 048/12","A","Aspekte der globalen Wissensgesellschaft"
"08-2012-047","08","2012","WD 8 - 047/12","AI","Das Abfackeln (gasflaring) und Ablassen (gasventing) von Begleitgasen bei der Erdölförderung"
"08-2012-037","08","2012","WD 8 - 037/12","A","Wirkung militärisch genutzter/Treibstoffe und zivil genutzter Treibstoffe auf Gesundheit und Umwelt"
"08-2012-036","08","2012","WD 8 - 036/12","A","Das Abfackeln (gas flaring) und Ablassen (gas venting) von Begleitgasen bei der Erdölförderung"
"08-2012-023","08","2012","WD 8 - 023/12","A","Beteiligung von Frauen an der Technikentwicklung und Produktgestaltung"
"08-2012-016","08","2012","WD 8 - 016/12","A","Globale Verteilung von Wissen"
"08-2012-007","08","2012","WD 8 - 007/12","A","Atomenergie - Wie viele Atomkraftwerke werden weltweit gebraucht, um sich auf die Form der Energieerzeugung zu konzentrieren?"
"08-2011-158","08","2011","WD 8 - 158/11","A","Das negative Stimmgewicht und die Wahlrechtsreform 2011 - Zur rechnerischen Prüfung von Sitzzuteilungsmodellen"
"08-2011-153","08","2011","WD 8 - 153/11","A","Zur Endlagerung hochradioaktiver Abfälle - Vorgehensweise in Finnland, Schweden, Frankreich, der Schweiz und den USA"
"08-2011-150","08","2011","WD 8 - 150/11","A","Griechenlands Forschungs- und Innovationssystem"
"08-2011-144","08","2011","WD 8 - 144/11","A","Strahlungsmessungen am Transportbehälterlager Gorleben - Zur Einordnung bisher bekannt gewordener Messwerte"
"08-2011-137","08","2011","WD 8 - 137/11","A","Gärreste aus Biogasanlagen und Botulismus bei Nutztieren"
"08-2011-135","08","2011","WD 8 - 135/11","A","Open Access - Konzeptionelle Grundlagen und Entwicklungsstand in ausgewählten Schwellenländern"
"08-2011-128","08","2011","WD 8 - 128/11","A","Zur Berechnung negativer Stimmgewichte - Methodik und Ergebnisse der Prüfung aktueller Wahlrechtsmodelle"
"08-2011-127","08","2011","WD 8 - 127/11","A","Zur Berechnung negativer Stimmgewichte - Methodik und Ergebnisse der Prüfung aktueller Wahlrechtsmodelle"
"08-2011-124","08","2011","WD 8 - 124/11","A","Aspekte der Bildungsteilhabe und beruflichen Qualifikation bei jungen Menschen mit Migrationshintergrund"
"08-2011-123","08","2011","WD 8 - 123/11","A","Aspekte der Einschränkung von Wissenschaftsfreiheit, insbesondere in den arabischen Staaten"
"08-2011-121","08","2011","WD 8 - 121/11","A","Schadstoffe und Hygiene von Biogasgärresten"
"08-2011-109","08","2011","WD 8 - 109/11","A","Informationen von Atomaufsichtsbehörden"
"08-2011-105","08","2011","WD 8 - 105/11","A","Zum Wahlrechtsmodell auf BT-Drs. 17/6290 - Einordnung mathematischer Eigenschaften des Reformentwurfs"
"08-2011-101","08","2011","WD 8 - 101/11","A","Das Karlsruher Institut für Technologie (KIT)"
"08-2011-091","08","2011","WD 8 - 091/11","A","Bundesuniversitäten"
"08-2011-082","08","2011","WD 8 - 082/11","A","Der REDD-Mechanismus - Stand der Realisierung vor dem Hintergrund internationaler Klimaverhandlungen"
"08-2011-067","08","2011","WD 8 - 067/11","A","Länder als getrennte Wahlgebiete? Mathematische Eigenschaften eines Vorschlags zur Reform des Bundestagswahlrechts"
"08-2011-037","08","2011","WD 8 - 037/11","A","Berechnung der Sitzverteilung im Europäischen Parlament - Gegenüberstellung zweier mathematischer Modelle"
"08-2011-024","08","2011","WD 8 - 024/11","A","Zur Finanzierung der nuklearen Entsorgung (Kostenprognosen, Rückstellungen und staatliche Überwachung)"
"08-2011-013","08","2011","WD 8 - 013/11","AI","Präimplantationsdiagnostik - Naturwissenschaftliche Grundlagen und medizinische Aspekte"
"08-2011-002","08","2011","WD 8 - 002/11","A","Durchlässigkeit von beruflicher Bildung und Hochschulbildung"
"08-2010-191","08","2010","WD 8 - 191/10","A","Entwicklung der Arbeitslosenversicherung seit 1969; Chronologie ausgewählter Kriterien zum Leistungsbezug"
"08-2010-183","08","2010","WD 8 - 183/10","A","Ausländische Studierende in Deutschland"
"08-2010-182","08","2010","WD 8 - 182/10","A","Struktur der Bildungssysteme in Deutschland und der Schweiz"
"08-2010-178","08","2010","WD 8 - 178/10","A","Präimplantationsdiagnostik - Naturwissenschaftliche Grundlagen und medizinische Aspekte"
"08-2010-177","08","2010","WD 8 - 177/10","A","Integrations- und Sprachkurssysteme für Migrantinnen und Migranten in ausgewählten europäischen Ländern"
"08-2010-171","08","2010","WD 8 - 171/10","A","Fragen zur Endlagerung von Atommüll"
"08-2010-169","08","2010","WD 8 - 169/10","A","Präimplantationsdiagnostik - Naturwissenschaftliche Grundlagen und medizinische Aspekte"
"08-2010-163","08","2010","WD 8 - 163/10","A","Ökobilanzen zu BTL - ein Studienvergleich"
"08-2010-154","08","2010","WD 8 - 154/10","A","Atommüll Lagerung in der EU und EU-Länder"
"08-2010-143","08","2010","WD 8 - 143/10","A","Demokratieförderung an Schulen"
"08-2010-139","08","2010","WD 8 - 139/10","A","Möglichkeit der Bürgerbeteiligung bei Planungsprozessen/Abläufen von Infrastrukturgroßprojekten am Beispiel von Stuttgart 21"
"08-2010-136","08","2010","WD 8 - 136/10","A","Bildungs- und Forschimgsausgaben der EU und EU Länder"
"08-2010-098","08","2010","WD 8 - 098/10","A","Finanzierung der beruflichen Weiterbildung durch ein Fondssystem in Frankreich und weiteren Ländern der Europäischen Union"
"08-2010-094","08","2010","WD 8 - 094/10","A","Die Beurteilung der Sicherheit deutscher Kernkraftwerke in der aktuellen fachwissenschaftlichen Debatte"
"08-2010-087","08","2010","WD 8 - 087/10","AI","Chinas Position in der Klimaschutzpolitik"
"08-2010-085","08","2010","WD 8 - 085/10","A","Gesundheitliche Auswirkung der Verbrennung von Biokraftstoffen in Fahrzeugmotoren"
"08-2010-079","08","2010","WD 8 - 079/10","AI","Der Weltklimarat - Aufgabe, Arbeitsweise und Reformdiskussion des Intergovernmental Panel on Climate Change (IPCC)"
"08-2010-078","08","2010","WD 8 - 078/10","AI","Stand der Umsetzung des Bologna-Prozesses"
"08-2010-057","08","2010","WD 8 - 057/10","AI","Motorverträglichkeit von Biokraftstoffen und Kraftstoffmischungen"
"08-2010-054","08","2010","WD 8 - 054/10","A","Stand der Umsetzung des Bologna-Prozesses"
"08-2010-046","08","2010","WD 8 - 046/10","A","Motorverträglichkeit von Biokraftstoffen und Kraftstoffmischungen"
"08-2010-037","08","2010","WD 8 - 037/10","A","Schulaufsicht an Internaten in Deutschland"
"08-2010-012","08","2010","WD 8 - 012/10","A","Aus-und Weiterbildung in der Tourismusbranche"
"08-2010-007","08","2010","WD 8 - 007/10","A","Bundesausgaben für Bildung und, Forschung in Deutschland und anderen OECD-Staaten"
"08-2009-114","08","2009","WD 8 - 114/09","A","Holzsequestrierung zur indirekten Vermeidung des Kohlendioxidausstoßes"
"08-2009-110","08","2009","WD 8 - 110/09","AI","Formen Erneuerbarer-Energien-Technologien - unter besonderer Berücksichtigung ihrer Einsatzmöglichkeiten und Potenziale für Schwellen- und Entwicklungsländer"
"08-2009-106","08","2009","WD 8 - 106/09","AI","Biokunststoffe"
"08-2009-104","08","2009","WD 8 - 104/09","A","Die Suche nach außerirdischem Leben und die Umsetzung der VN-Resolution A/33/426 zur Beobachtung unidentifizierter Flugobjekte und extraterrestrischen Lebensformen"
"08-2009-099","08","2009","WD 8 - 099/09","A","Finanzielle Fördermöglichkeiten für Studierende dualer Studiengänge (in der Erstausbildung)"
"08-2009-097","08","2009","WD 8 - 097/09","AI","Sitzzuteilungsverfahren - wahlmathematische Systematik und Stand der Diskussion"
"08-2009-092","08","2009","WD 8 - 092/09","A","Möglichkeiten und Grenzen des Einsatzes von humanen embryonalen Stammzellen im Rahmen von toxikologischen und pharmakologischen Prüfungen"
"08-2009-074","08","2009","WD 8 - 074/09","A","Regulierung von Stickoxidemissionen und gesundheitliche Bedeutung"
"08-2009-054","08","2009","WD 8 - 054/09","A","Beabsichtigt und unbeabsichtigt hergestellte Nanoteilchen: Bedeutung für Mensch und Umwelt"
"08-2009-048","08","2009","WD 8 - 048/09","A","School Shootings: Amokläufe an Schulen und Universitäten"
"08-2009-047","08","2009","WD 8 - 047/09","A","Homeschooling in westlichen Industrienationen"
"08-2009-046","08","2009","WD 8 - 046/09","A","Neuartige Biokraftstoffe der Mineralölwirtschaft: Mit Co-Hydrotreating und Hydrotreating zu erneuerbarem Diesel"
"08-2009-036","08","2009","WD 8 - 036/09","A","Verwendung von Studiengebühren in Deutschland"
"08-2009-020","08","2009","WD 8 - 020/09","AI","Negative Stimmgewichte und die Reform des Bundestags- Wahlrechts"
"08-2009-019","08","2009","WD 8 - 019/09","A","Pro und contra Kernenergie"
"08-2009-018","08","2009","WD 8 - 018/09","A","Energiesparlampen für besondere Anwendungen - Zusammenhänge mit der Diskussion um Energieeffizienz"
"08-2009-017","08","2009","WD 8 - 017/09","A","Bewerbungs- und Zulassungsmanagement an Hochschulen"
"08-2009-009","08","2009","WD 8 - 009/09","A","Finanzierung der Nabelschnurblutstammzellforschung und Regelung der Lagerung sowie Gewinnung von Nabelschnurblut im internationalen Vergleich"
"08-2008-172","08","2008","WD 8 - 172/08","A","Stand der Forschung und der therapeutischen Anwendung von Nabelschnurblutstammzellen"
"08-2008-160","08","2008","WD 8 - 160/08","A","Potentielle finanzielle Auswirkungen der Ziele des Bildungsgipfels auf die Haushalte des Bundes und der Länder"
"08-2008-159","08","2008","WD 8 - 159/08","A","Kohlendioxidsequestrierung (CCS): Innovationspolitik in Deutschland und der EU"
"08-2008-145","08","2008","WD 8 - 145/08","A","Energiesparlampen: Zur Energiebilanz und Ökobilanz"
"08-2008-134","08","2008","WD 8 - 134/08","A","Altenbildung"
"08-2008-121","08","2008","WD 8 - 121/08","A","Teil 1: Vor- und Nachteile der Grünen Gentechnik - Teil 2: Gesetzliche Regelung zur Grünen Gentechnik"
"08-2008-100","08","2008","WD 8 - 100/08","A","Die aktuelle Bildungs-, Familien-, Umwelt- und Energiepolitik: konservativ?"
"08-2008-096","08","2008","WD 8 - 096/08","A","Ausbau der Stromnetze: Technische Hintergründe"
"08-2008-095","08","2008","WD 8 - 095/08","AI","Klimapolitische Entwicklung in den USA"
"08-2008-090","08","2008","WD 8 - 090/08","A","Hybrid-Embryonen"
"08-2008-067","08","2008","WD 8 - 067/08","A","Die Ausgestaltung des Clean Development Mechanismus durch die UN-Klimakonferenz"
"08-2008-064","08","2008","WD 8 - 064/08","A","Kita-Bildungsprogramme der Bundesländer im Vorschulalter"
"08-2008-063","08","2008","WD 8 - 063/08","A","Das LHC-Projekt am CERN: Gefahr durch schwarze Löcher?"
"08-2008-053","08","2008","WD 8 - 053/08","A","Erfahrungen mit dem Clean Development Mechanism: Umweltintegrität und Klimaeffizienz"
"08-2008-046","08","2008","WD 8 - 046/08","A","Unabhängige Pharmaforschung"
"08-2008-029","08","2008","WD 8 - 029/08","A","Die Außenwissenschaftspolitik Deutschlands - Internationalisierung von Wissenschaft und Forschung in Deutschland"
"08-2008-022","08","2008","WD 8 - 022/08","A","Integration und Inklusion - Zwei Grundbegriffe in Erziehungswissenschaft und Behindertenpädagogik"
"08-2008-020","08","2008","WD 8 - 020/08","A","Auswirkungen des Klimawandels auf den Wasserhaushalt und Möglichkeiten der Anpassung"
"08-2008-019","08","2008","WD 8 - 019/08","A","Bedrohte Ressourcen Wasser - Internationale Einschätzungen von Ursachen und Folgen"
"08-2008-018","08","2008","WD 8 - 018/08","A","Internationale Konzepte zum Wassermanagement"
"08-2007-205","08","2007","WD 8 - 205/07","A","Aktuelle Initiative zur Förderung der Qualität der Hochschullehre in Deutschland"
"08-2007-196","08","2007","WD 8 - 196/07","A","Politiken im Bereich Klimawandel, Klimasicherheit und sichere Energieversorgung von ausgewählten internationalen Regimen und Institutionen"
"08-2007-155","08","2007","WD 8 - 155/07","A","Kollektive Intelligenz - ein Ansatz für die Clusterpolitik?"
"08-2007-149","08","2007","WD 8 - 149/07","A","Definition, Diskussion und Bedeutung verschiedener Indikatoren für Klimaziele"
"08-2007-141","08","2007","WD 8 - 141/07","A","Stromleitungen: Erdkabel vs. Freileitungen, Wechselstrom- vs. Gleichstromübertragung"
"08-2007-133","08","2007","WD 8 - 133/07","A","Forschungsaktivität der Industrie in Großbritannien und Kanada im Vergleich zu Deutschland"
"08-2007-121","08","2007","WD 8 - 121/07","AI","Raketenabwehr - technische Aspekte und naturwissenschaftlicher Hintergrund"
"08-2007-105","08","2007","WD 8 - 105/07","A","Definition, Diskussion und Bedeutung verschiedener Klimaziele - Pro-Kopf-Reduktionsziele und wirtschaftsgekoppelte Reduktionsziele"
"08-2007-076","08","2007","WD 8 - 076/07","A","Die Schulsysteme in den Niederlanden und Singapurs"
"08-2007-059","08","2007","WD 8 - 059/07","AI","Die Europäische Atomgemeinschaft (EURATOM)"
"08-2007-056","08","2007","WD 8 - 056/07","A","C02-Bilanzen verschiedener Energieträger im Vergleich"
"08-2007-047","08","2007","WD 8 - 047/07","AI","Der Europäische Forschungsrat"
"08-2007-036","08","2007","WD 8 - 036/07","A","Zusammenhang zwischen der Krebsentstehung und adulten bzw. embryonalen Stammzellen"
"08-2007-032","08","2007","WD 8 - 032/07","AI","Open Source Software"
"08-2007-028","08","2007","WD 8 - 028/07","AI","Bachelor- und Masterstudienabschlüsse - Perspektiven deutscher Hochschulabsolventen"
"08-2007-024","08","2007","WD 8 - 024/07","A","Förderung der embryonalen Stammzellforschung im internationalen Vergleich"
"08-2007-004","08","2007","WD 8 - 004/07","A","Ist der Treibhauseffekt real? - Zu einigen Argumenten von Klima- Skeptikern"
"08-2007-003","08","2007","WD 8 - 003/07","A","Vereinheitlichung der Hochschulabschlüsse in Europa (Bologna-Prozess)"
"08-2006-240","08","2006","WD 8 - 240/06","AI","Integration durch Bildung im vorschulischen Bereich und in der Primarstufe"
"08-2006-235","08","2006","WD 8 - 235/06","A","Stand der Forschung und Potenziale von embryonalen Stammzellen"
"08-2006-231","08","2006","WD 8 - 231/06","A","Vor- und Nachteile der Gesamtschule bzw. des dreiteiligen Schulsystems"
"08-2006-224","08","2006","WD 8 - 224/06","A","Zu den Umverteilungswirkungen staatlicher Hochschulfinanzierung"
"08-2006-215","08","2006","WD 8 - 215/06","A","Wissenschaftliche Begleitforschung zu Ganztagsschulen"
"08-2006-212","08","2006","WD 8 - 212/06","AI","Der Studentenberg - Kollaps der Universitäten oder Illusion? Ein kritischer Beitrag zur aktuellen Information"
"08-2006-189","08","2006","WD 8 - 189/06","A","Das Berufsbild „Lecturer“"
"08-2006-179","08","2006","WD 8 - 179/06","AI","Die Deutsche Forschungsgemeinschaft (DFG) - Strukturen, Verfahren, Reformbedarf"
"08-2006-175","08","2006","WD 8 - 175/06","A","Die Geisteswissenschaften in der Diskussion"
"08-2006-174","08","2006","WD 8 - 174/06","A","Grüne Gentechnologie - „Smart breeding“"
"08-2006-169","08","2006","WD 8 - 169/06","AI","Erfahrungen nach dem ersten Jahr des europäischen Emissionshandels - Auswirkungen auf die weitere Reduktion der Treibhausgasemissionen"
"08-2006-138","08","2006","WD 8 - 138/06","A","Bildung und Weiterbildung in der Lissabon-Strategie"
