"WD5-154/12";"A";"Vergleich nationaler Standards von Forstzertifikaten in ausgewählten europäischen Ländern - FSC und PEFC in Deutschland, Dänemark, Finnland, Schweden, Russland und Tschechien"
"WD5-155/08";"A";"Geschwindigkeitsmessung im Straßenverkehr"
"WD5-158/08";"A";"Einzelhandel in Deutschland - Verkaufsflächen und Sortimentregelungen"
"WD5-159/09";"A";"Zur Frage der Auswirkungen einer Laufzeitverlängerung für deutsche Kernkraftwerke auf den Handel mit C02- Emissionszertifikaten"
"WD5-160/08";"A";"Zuständigkeiten für Wasserstraßen in ausgewählten europäischen Ländern"
"WD5-160/09";"A";"Selbstfinanzierung von Steuersenkungen"
"WD5-162/09";"A";"Beantwortung eines Fragenkataloges zum Straßenbau, zur technischen Konstruktion, zu Lärmschutzansprüchen und zu den Auswirkungen eines Tempolimits"
"WD5-166/08";"A";"Regelungen in der Anlagen- und Kreditberatung zwischen Kunde und Berater"
"WD5-168/06";"A";"Rechtliche Prüfung einer Regulierung der Preisbildung im Strommarkt zur Verhinderung von Windfall Profits durch den Emissionshandel"
"WD5-168/09";"A";"Deutsche Post AG und Postbinnenmarkt sowie Privatisierung der japanischen Post"
"WD5-170/10";"A";"Auswirkungen einer Laufzeitverlängerung für Kernkraftwerke"
"WD5-170/11";"AI";"Die Wiederentdeckung der Landwirtschaft in der Entwicklungszusammenarbeit"
"WD5-171/07";"A";"Zur Berechnung des Netzkaufpreises im Rahmen einer Stromnetzübernahme"
"WD5-173/08";"A";"Ausschluss von Palmöl und anderen Biokraftstoffen aus der EEG- Förderung - Aktualisierung"
"WD5-174/07";"A";"Veterinär- und Lebensmittelaufsicht - Die europäische Kontrollverordnung (Verordnung EG Nr. 882/2004)"
"WD5-174/10";"AI";"Zur Diskussion um Konzepte wirtschaftlichen Wachstums"
"WD5-175/06";"A";"Energiepass - Nach Bedarf oder Verbrauch? Positionen von Fraktionen und Verbänden"
"WD5-178/07";"A";"Zum Wasserverbrauch von Biokraftstoffen"
"WD5-178/12";"A";"Umsätze und Wachstumsprognosen im Handel mit ökologischen Agrar- und Forstprodukten und im Tourismus"
"WD5-180/09";"A";"Regelungen einzelner Bundesländern bei Biberschäden"
"WD5-181/09";"A";"Staatliche Beihilfen für Biokraftstoffe"
"WD5-184/07";"A";"Investitionen ausländischer Staatsfonds"
"WD5-184/08";"A";"Milton Friedman: Negative Einkommensteuer"
"WD5-184/09";"A";"Verbraucherinteressenvertretung im internationalen Vergleich"
"WD5-189/06";"AI";"Ökolandbau-Verordnung, ein Kommissionsvorschlag in der Kritik"
"WD5-189/08";"A";"Konjunkturprogramme in der Geschichte der Bundesrepublik Deutschland: Einordnung und Bewertung der Globalsteuerung von 1967 bis 1982"
"WD5-190/06";"AI";"Grünbuch Europäische Transparenzinitiative"
"WD5-190/11";"A";"Fragen zur Finanzierung beim Bau von Bundesautobahnen und Bundesfernstraßen"
"WD5-194/08";"A";"Wirtschaftlichkeit von Behörden und Anstalten des öffentlichen Rechts"
"WD5-195/07";"A";"Prognosen zum Ausbau der Geothermie - Perspektiven bis 2050"
"WD5-198/07";"A";"Elektronische Kennzeichnung von Wiederkäuern"
"WD5-198/08";"A";"Fragenkatalog: Verbraucherrechte und Verbraucherorganisationen sowie Energiemarktregulierung in ausgewählten europäischen • Staaten Wasser- und Abfallentsorgungspreise"
"WD5-201/06";"A";"Finanzierung eines bedingungslosen Grundeinkommens in Deutschland"
"WD5-202/10";"A";"Vorschlag für eine Verordnung zur Änderung der Richtlinie 2011/18/EG betreffend die den Mitgliedstaaten eingeräumte Möglichkeit, den Anbau von GVO auf ihrem Hoheitsgebiet zu beschränken oder zu untersagen - Vereinbarkeit mit den Binnenmarktvorschriften der Europäischen Union und den WTO- Vorschriften"
"WD5-203/06";"A";"Aspekte der Preisbindung zweiter Hand in Deutschland und im Ausland"
"WD5-203/10";"A";"Laufzeiten der Atomkraftwerke Neckarwestheim und Philippsburg"
"WD5-204/11";"AI";"Land Grabbing - Ursachen, Wirkungen, Handlungsbedarf"
"WD5-205/06";"A";"Agrar-Absatzförderung in den Mitgliedstaaten der EU"
"WD5-208/11";"A";"Schalenwilddichten in Deutschland"
"WD5-212/07";"A";"Breitbandanbieter"
"WD5-213/06";"A";"Rechtsfragen zur Grünen Gentechnik"
"WD5-217/06";"AI";"Für ein mobiles Europa - Nachhaltige Mobilität für unseren Kontinent - Halbzeitbilanz zum Verkehrsweißbuch ¥on 2001 -"
"WD5-218/06";"A";"Verfassungsrechtliche Einzelfragen zur Anreizregulierung nach § 21aEnWG"
"WD5-220/11";"A";"Finanzierung des ÖPNV in Deutschland und in einzelnen europäischen Staaten"
"WD5-221/07";"A";"Fragen zur Marktordnung für Ethylalkohol landwirtschaftlichen Ursprungs"
"WD5-224/10";"A";"Verbot von Nahrungsmittelspekulationen"
"WD5-226/10";"A";"Zum Streit über die Bewirtschaftung der Rehwildbestände"
"WD5-227/07";"A";"Deutsche Bahn: 1980 - 2006"
"WD5-228/07";"A";"Aspekte der Bahnreformen in ausgewählten Ländern"
"WD5-229/07";"A";"Vereinbarung der nationalen Einführung eines Top-Runner-Programms mit europäischem Gemeinschaftsrecht"
"WD5-230/06";"A";"Grundlegende Forschungsergebnisse des Wirtschaftsnobelpreisträgers 2006, Edmund S. Phelps, und deren Folgerungen für die Wirtschaftspolitik"
"WD5-232/06";"A";"Radio Frequency Identification (RFID) - Wirtschaftlichkeit und gesetzliche Regelungen- unter besonderer Berücksichtigung der Luftfahrtindustrie"
"WD5-236/06";"A";"Reform der Gemeinsamen Marktorganisationen für Obst und Gemüse"
"WD5-236/07";"A";"Frequenzordnung"
"WD5-237/07";"A";"Ökonomische Auswirkungen einer (vollständigen)Auktionierung von C02-Emissionszertifikaten"
"WD5-242/07";"A";"Erneuerbare Energien und Energieeffizienz in der Energie- Außenpolitik der EU"
"WD5-248/10";"A";"Die Rechtmäßigkeit der finanziellen Förderung eines Verbraucherportals"
"WD5-254/06";"A";"Entwicklung des Energiemix"
"WD5-267/06";"A";"Legehennenhaltung"
"WD5-268/06";"A";"Erneuerbare Energie in der EU"
"WD6-001/11";"AI";"Arbeitnehmerfreizügigkeit nach der Osterweiterung der Europäischen Union; Chancen und Risiken für den Arbeitsmarkt"
"WD6-001/12";"A";"Nutzung dienstlicher Ressourcen zur Ausübung einer Lehrtätigkeit als Honorarprofessor"
"WD6-002/09";"A";"Rechtliche Rahmenbedingungen von Lehrenden in der Weiterbildung"
"WD6-002/10";"A";"Ausweitung öffentlich geförderter Beschäftigung; Argumente, Standpunkte und Erfahrungen"
"WD6-005/13";"A";"Arbeitnehmerkontrolle durch Telefonüberwachung in Call- Centern"
"WD6-006/07";"A";"Entwicklung der Hinterbliebenenvorsorge in der gesetzlichen Rentenversicherung sowie Beantwortung von Fragen zu bestimmten Fallgestaltungen"
"WD6-006/08";"A";"Alterssicherung Selbstständiger in Deutschland und Europa"
"WD6-006/11";"A";"Alterssicherung in Dänemark"
"WD6-008/08";"A";"Informationen zum Schweizer Rentensystem und seine Übertragbarkeit auf Deutschland"
"WD6-008/11";"A";"Ausgewählte Fragen zum Saison-Kurzarbeitergeld im Bauhauptgewerbe"
"WD6-008/12";"A";"Verpflichtung von Beziehern von Leistungen der Grundsicherung zu Arbeit in der Pflege Vereinbarkeit mit Verfassungsrecht und internationalen Konventionen"
"WD6-010/06";"A";"Aktuelle Rechtslage der Rentenversicherung in den Niederlanden"
"WD6-011/12";"A";"Arbeitnehmerrechte in der Insolvenz"
"WD6-013/11";"A";"Auswirkung einer verschwiegenen Stasi-Tätigkeit auf den Bestand des zugrundeliegenden Arbeitsverhältnisses eines Abgeordnetenmitarbeiters"
"WD6-014/13";"A";"Arbeitsmarkt- und rentenpolitische Instrumente zum Übergang von der Erwerbsarbeit oder Arbeitslosigkeit in den Ruhestand"
"WD6-017/09";"A";"Einzelfragen zu Leiharbeit in kirchlichen Einrichtungen"
"WD6-018/09";"AI";"Die Leiharbeitsrichtlinie"
"WD6-022/06";"A";"Gesetzliche und verordnungsrechtliche Regelung der Arbeits-, Lenk- und Ruhezeiten für Omnibusfahrer, Lokführer und Piloten"
"WD6-022/12";"A";"Alterssicherung bei selbstständiger Tätigkeit; Welche Altersvorsorgemöglichkeiten sind für Selbstständige vorgesehen?"
"WD6-026/06";"A";"Überblick über das Schweizer Rentensystem, insbesondere die Alters- und Hinterbliebenenversorgung"
"WD6-026/11";"A";"Das Asylbewerberleistungsgesetz (AsylbLG) im Hinblick auf das ""Regelsatzurteil"" des Bundesverfassungsgerichts (BVerfG)"
"WD6-027/13";"A";"Arbeiten im Rentenalter - Studien, Statistiken, rechtliche Aspekte"
"WD6-028/09";"A";"Bisherige Mitarbeiterbeteiligungsmodelle und Neuerungen durch das Mitarbeiterkapitalbeteiligungsgesetz"
"WD6-029/08";"A";"Bürgerarbeit"
"WD6-030/12";"A";"Die rückwirkende Ablösung des Fremdrentenrechts für nach 1936 geborene Übersiedler und Flüchtlinge aus der DDR im Rahmen der Rentenüberleitung"
"WD6-032/09";"A";"Regelungen zur gesetzlichen und privaten Krankenversicherung im Rahmen der Hilfe zum Lebensunterhalt"
"WD6-034/06";"A";"Sozialversicherungsrechtliche Stellung von Prostituierten in den EU-Mitgliedstaaten"
"WD6-035/09";"A";"Die Situation von Frauen im Arbeitsleben in Deutschland; Wissenschaftliche Befunde und politische Forderungen"
"WD6-035/12";"A";"Vereinbarkeit von §§ 4 und 6 Asylbewerberleistungsgesetz mit Verfassungs-, Europa- und Völkerrecht"
"WD6-041/07";"A";"Vorgaben und Definition für den Niedriglohnbereich"
"WD6-042/06";"A";"Daten zur Beitragslast und Rente eines Eckrentners (Rendite), Lebenserwartung und Verhältnis Beitragszahler zu Rentnern"
"WD6-042/11";"A";"Anwendung des Arbeitszeitgesetzes auf die Arbeitsverhältnisse zwischen Abgeordneten und Mitarbeitern"
"WD6-043/06";"A";"Höhe und Zusammensetzung der Bundeszuschüsse an die gesetzliche Rentenversicherung"
"WD6-044/06";"A";"Nötigung von Verfassungsorganen durch den angekündigten .Streik der Bahngewerkschaften"
"WD6-045/07";"A";"Rechtliche Rahmenbedingungen für die Gründung von Betriebsräten durch Abgeordnetenmitarbeiter"
"WD6-045/12";"A";"Arbeitsrecht der Kirchen in Deutschland; Rechtsprechung des Europäischen Gerichtshofs für Menschenrechte"
"WD6-046/10";"A";"Atypische und prekäre Beschäftigung in Deutschland"
"WD6-050/09";"A";"Rechte aus UN-Konvention/Behindertengleichstellungsgesetz in Bezug auf Teilhabe am öffentlich-rechtlichen Rundfunk sowie Internetangeboten von Staat/Parteien"
"WD6-052/10";"A";"Öffentliche Vergabe sozialer Leistungen durch die Bundesagentur für Arbeit; unter besonderer Berücksichtigung der Rehabilitation und Teilhabe behinderter Menschen"
"WD6-053/12";"A";"Die Beteiligungsrechte der Mitarbeitervertretungen nach kirchlichem Arbeitsrecht und Betriebsverfassungsrecht; Vergleich der Regelungen der Rahmenordnung der Deutschen Bischofskonferenz für eine Mitarbeitervertretungsordnung (MAVO), des Kirchengesetzes über Mitarbeitervertretungen in der Evangelischen Kirche in Deutschland (MVG.EKD) und des Betriebsverfassungsgesetzes (BetrVG)"
"WD6-055/10";"AI";"Ausweitung öffentlich geförderter Beschäftigung; Argumente, Standpunkte und Erfahrungen"
"WD6-057/06";"A";"Grundinformationen zu Tarifrecht und Tarifverträgen"
"WD6-057/09";"A";"Zum Aufenthaltsrecht von Bürgern anderer EU-Mitgliedstaaten in Deutschland sowie ihrem Anspruch auf Sozialleistungen; Teilauftrag Punkt 2"
"WD6-069/11";"A";"Mitarbeiterkapitalbeteiligung in ausgewählten EU- Mitgliedstaaten; Modelle und ihre Verbreitung"
"WD6-069/12";"A";"Rentenrechtliche Berücksichtigung von Zeiten der Beschäftigung in einem Ghetto während des Zweiten Weltkriegs; Zwischen Entschädigung für erlittenes Unrecht und Anerkennung geleisteter Arbeit"
"WD6-076/06";"A";"Demografische Entwicklung und Fachkräftemangel in Deutschland, insbesondere Ostdeutschland und Sachsen"
"WD6-077/13";"A";"Leistungen der Rentenversicherung und der Beamtenversorgung des Bundes - Entwicklung und gesetzliche Regelungen mit größerer Tragweite seit Ende der 70er Jahre"
"WD6-078/12";"A";"Geschlechtsspezifische Entgeltungleichheit in Deutschland"
"WD6-079/06";"A";"Sozialrecht und freie Studien- und Berufswahl/Nachteilsausgleich in Zulassungsordnungen für Masterstudiengänge"
"WD6-079/13";"A";"Schwedens Rentenreform 1998 - Entstehung und Motive"
"WD6-082/08";"A";"EU-rechtliche Zulässigkeit einer allgemeinen Öffnungsklausel im Arbeitszeitrecht für den Theater- und Bühnenbereich"
"WD6-083/06";"A";"Rente und Hinzuverdienst I Einkommensanrechnung"
"WD6-085/06";"A";"Informationen zur Rente, Grunddaten zur Finanzierung, Kindererziehungszeiten und Alternativen, Internationaler Vergleich, insbesondere Schweden und Niederlande"
"WD6-086/07";"A";"Lohngleichheit zwischen Frau und Mann in der Schweiz"
"WD6-089/07";"A";"Beitragsfreie Entgeltumwandlung in der betrieblichen Altersvorsorge - Pro und Contra"
"WD6-091/11";"A";"Generation Praktikum; Rechtliche Rahmenbedingungen und aktuelle Studien"
"WD6-093/06";"A";"Rechtsentwicklung zur Überleitung von Renten-, Zusatz- und Sonderversorgungsansprüchen der ehemaligen DDR"
"WD6-094/12";"A";"Frauen in atypischer Beschäftigung; Studien und Statistiken"
"WD6-103/06";"A";"Generalstreik- Rechtliche Bedingungen und Streikkultur im Vergleich"
"WD6-108/06";"A";"System der Rentenversicherung und Rentenreform in England"
"WD6-108/07";"A";"Lohngleichheit zwischen Frau und Mann als Bedingung im deutschen Vergaberecht"
"WD6-109/12";"A";"Rentenrechtliche Gleichstellung jüdischer Zuwanderer aus der früheren Sowjetunion mit Spätaussiedlern?"
"WD6-110/09";"A";"Lenk- und Ruhezeiten im Nah- und Fernverkehr"
"WD6-111/11";"A";"Fachkräftemangel in Deutschland; Statistiken, Prognosen und Lösungsansätze"
"WD6-112/06";"A";"Entwicklung der steuerfinanzierten Bundeszuschüsse an die gesetzliche Renten- und Arbeitslosenversicherung und Wirkungen einer Umfinanzierung von Beiträgen zu Steuern auf die Finanzsituation und die Demographiefestigkeit der Systeme"
"WD6-114/07";"A";"Sozialversicherungspflicht für kommunales Ehrenamt"
"WD6-117/07";"A";"Die Arbeitsbedingungen von Abgeordnetenmitarbeitern in der EU, in den europäischen Mitgliedstaaten und den Länderparlamenten"
"WD6-118/08";"A";"Ergänzende Informationen zum Versicherungsschutz von ehrenamtlich Tätigen im Ausland"
"WD6-121/08";"A";"Zur Anwendungspraxis des Künstlersozialversicherungsgesetzes"
"WD6-122/06";"A";"Übersicht über die Bekämpfung der Schwarzarbeit in ausgewählten Ländern der EU und den Vereinigten Staaten (USA)"
"WD6-125/09";"A";"Ausführungen zur bisherigen Debatte zur Höhe der Kinderregelsätze"
"WD6-126/06";"AI";"Die Evaluierung von Hartz I-III im Überblick"
"WD6-127/07";"A";"Zu den Auswirkungen des Familienstandes der Ehe im Sozialrecht (SGB II, VI, VII und XII) und bei der sozialen Entschädigung nach dem Bundesversorgungsgesetz"
"WD6-127/10";"A";"Zur sozialen Situation von Personen mit Migrationshintergrund"
"WD6-128/09";"A";"""Bagatelldelikte"" im Arbeitsrecht; Rechtsprechung und wissenschaftliche Debatte"
"WD6-129/06";"A";"Fragen zur Altersversorgung der technischen Intelligenz, speziell zum Personenkreis der Chemiker und Physiker, in der ehemaligen DDR"
"WD6-129/09";"A";"Überblick über die betriebliche Altersversorgung"
"WD6-130/07";"A";"Beitragseinzugsverfahren bei den landwirtschaftlichen Berufsgenossenschaften; Möglichkeit einer Umstellung vom Umlageverfahren auf das Kapitaldeckungsverfahren"
"WD6-130/12";"A";"Sanktionen nach dem SGB II, SGB XII und im Asylbewerberleistungsgesetz (AsylbLG) - aktualisiert"
"WD6-132/12";"A";"Geringfügige Beschäftigung - Gesetzgeberische Motivation, Kritik und Änderungsvorschläge"
"WD6-135/11";"A";"Die Berücksichtigung von Einkommen aus dem Bundesfreiwilligendienst im SGB II; Möglichkeiten zur Anhebung des Freibetrages"
"WD6-136/07";"A";"Die Massenentlassungsverfahren im französischen Arbeitsrecht"
"WD6-138/06";"A";"Verbesserung des Nichtraucherschutzes am Arbeitsplatz"
"WD6-138/12";"A";"Weiterentwicklung der Alterssicherung - Zur Resolution der Jungen Union Bayern un der Senioren-Union der CSU vom 11. Juli 2009"
"WD6-141/11";"A";"Ehemalige MfS-Mitarbeiter bei der Behörde des BStU; Eine Darstellung und Bewertung des Gutachtens von Prof. Dr. Johannes Weberling"
"WD6-142/06";"A";"Nichteinbeziehung der Diplom-Chemiker und Diplom-Physiker in die zusätzliche Altersversorgung der technischen Intelligenz"
"WD6-143/11";"A";"Kündigung eines Arbeitnehmers wegen Beteiligung an wettbewerbswidrigem Verhalten des Unternehmens; Arbeitsrechtliche Konsequenzen aufgrund der Verletzung vertraglicher Nebenpflichten"
"WD6-145/11";"A";"Möglichkeiten der Einrichtung einer Interessenvertretung der Abgeordnetenmitarbeiter"
"WD6-147/06";"A";"Zugang nicht-öffentlicher Stellen zu Stasi-Unterlagen"
"WD6-147/08";"A";"Leistungen für Träger von Heimen sowie zur Teilhabe behinderter Menschen am gesellschaftlichen Leben"
"WD6-153/07";"A";"Zum Weiterbeschäftigungsanspruch nach den §§ 78a Abs. 2 BetrVG, 9 Abs. 2 BPersVG bei der Verbundausbildung"
"WD6-153/11";"A";"Menschen ohne Papiere; Ihr Recht auf Gesundheit und ihr Zugang zu medizinischer Versorgung"
"WD6-153/12";"A";"Der Begriff ""vorübergehend"" im Arbeitnehmerüberlassungsgesetz"
"WD6-159/06";"A";"Verbesserung der Regelungen zum Nichtraucherschutz in Deutschland und Rechtslage in den Mitgliedstaaten der EU"
"WD6-162/12";"A";"Ansprüche aus der gesetzlichen Rentenversicherung für Beschäftigte der NSDAP und anderen verbrecherischen Organisationen zur Zeit des Nationalsozialismus"
"WD6-163/06";"A";"Alternative Finanzierungsmodelle zur Rentenversicherung hier; Steuerfinanzierte Grundrente"
"WD6-164/06";"A";"Auswirkungen des allgemeinen Gleichbehandlungsgesetzes auf die Regelungen im Arbeitsrecht wegen geschlechtsbezogener Benachteiligung"
"WD6-164/12";"A";"Rentenpolitische Entscheidungen mit größerer Tragweite seit 1949"
"WD6-165/12";"A";"Beschäftigungssicherung in der jüngsten Wirtschaftskrise - Kurzarbeit und Arbeitszeitflexibilität"
"WD6-166/07";"A";"Die Scheinselbständigkeit im Sozialversicherungsrecht"
"WD6-166/12";"A";"Telearbeit in Deutschland - Formen, arbeitsrechtliche Aspekte und Handlungsempfehlungen"
"WD6-170/12";"A";"Zur Frage möglicher Änderungen der betriebsverfassungsrechtlichen Rahmenbedingungen in Betrieben mit kirchlicher Trägerschaft"
"WD6-171/07";"A";"Die Pflicht des Arbeitgebers zur Erstattung von Arbeitslosengeld nach § 147a SGB III; Historische Entwicklung und aktuelle Rechtslage"
"WD6-174/10";"A";"Leiharbeit in Frankreich; Gesetzliche Regelungen und historische Entwicklung"
"WD6-175/06";"A";"Verbesserung des Nichtraucherschutzes am Arbeitsplatz"
"WD6-178/11";"A";"Zum Transfer passiver in aktive Leistungen im Rechtskreis des SGBII"
"WD6-181/11";"A";"Zuwanderungsregelungen für Fachkräfte in europäischen Ländern"
"WD6-185/11";"A";"Fragen zur Anrechnung/Abrechnung angeordnete!' Überstunden in der Verwaltung des Deutschen Bundestages"
"WD6-186/11";"A";"Das Selbstbestimmungsrecht der Kirchen in Deutschland; Loyalitätspflichten kirchlicher Arbeitnehmer und Leiharbeit in kirchlichen Einrichtungen"
"WD6-187/08";"A";"Zur Niedriglohnbeschäftigung und Zeitarbeit"
"WD6-189/11";"AI";"Fachkräftemangel in Deutschland; Statistiken, Studien und Strategien"
"WD6-190/08";"A";"Medizinischer Mehrbedarf im Sozialrecht - Einführung & Entwicklung"
"WD6-191/08";"A";"Voraussetzungen und Erfahrungen des Sabbaticals in der freien Wirtschaft"
"WD8-191/10";"A";"Entwicklung der Arbeitslosenversicherung seit 1969; Chronologie ausgewählter Kriterien zum Leistungsbezug"
"WD6-194/07";"A";"Rentenberechnung für sog. Altübersiedler"
"WD6-195/07";"A";"Zur Internationalen Konvention zum Schutz der Rechte aller Wanderarbeitnehmer und ihrer Familienangehörigen; Teil 2; Zur Umsetzung der Konvention erforderliche Gesetzesänderungen"
"WD6-197/10";"A";"Saisonbeschäftigung und konzerninterne Arbeitnehmerentsendung von Drittstaatsangehörigen in der EU; Aufenthalts- und arbeitserlaubnisrechtliche Regelungen in den Mitgliedstaaten"
"WD6-198/11";"A";"Übermittlung von elektronischen Sozialdaten in anderen EU- Ländern"
"WD6-202/11";"A";"Rechtsänderungen im Hinblick auf die Verschlechterungsverbote im Assoziationsrecht zwischen der EU und der Türkei"
"WD6-205/07";"A";"Arbeitsgemeinschaften nach § 44b SGB II; Aufgaben, Struktur und Aufsicht"
"WD6-205/11";"A";"Berufsunfähigkeit in der landwirtschaftlichen Alterssicherung; Keine Rente wegen teilweiser Erwerbsminderung für berufsunfähige Landwirte"
"WD6-207/10";"A";"Vorzeitiger Altersrentenantritt bei besonders belasteten Berufsgruppen; internationaler Vergleich"
"WD6-211/06";"A";"Leistungen für behinderte Menschen im Rechtskreis des SGB II"
"WD6-216/10";"A";"Kirchliche Selbstbestimmung im kollektiven Arbeitsrecht und ihre Vereinbarkeit mit Europarecht"
"WD6-217/10";"A";"Teilhabe behinderter Menschen am Arbeitsmarkt; Definitionen, Gesetze, Statistiken, Fördermöglichkeiten, Projekte, Forschung"
"WD6-219/10";"A";"Förderung von Bildungsmaßnahmen sowie Maßnahmen der beruflichen Aus- und Weiterbildung; Gesetzliche Grundlagen"
"WD6-220/06";"A";"Das Kombilohnmodell des Sachverständigenrates und der Standpunkt von Prof. Bofinger"
"WD6-222/10";"A";"Entgeltunterschiede zwischen Männern und Frauen in Deutschland und in den Mitgliedstaaten der Europäischen Union; Gesetzliche Regelungen, betriebliche Arbeitsbewertungssysteme und Kontrollverfahren"
"WD6-225/06";"A";"Änderung des § 14 Abs. 3 des Teilzeit- und Befristungsgesetzes im Lichte der Rechtsprechung des EuGH"
"WD6-230/07";"A";"Zum Einfluss der europäischen auf die deutsche Sozialpolitik"
"WD6-257/06";"A";"Berücksichtigung von Ehegatten, eingetragenen Lebenspartnern und nicht-ehelichen Lebenspartnern bei der Grundsicherung für Arbeitssuchende, wegen Alters und Erwerbsminderung, der Sozialhilfe, in der gesetzlichen Renten- und Unfallversicherung sowie im Rahmen des BaföG"
"WD6-262/06";"A";"Die Montan-Mitbestimmung und die ""leges Mannesmann"""
"WD6-274/06";"A";"Informationen zum möglichen Versicherungsschutz in der gesetzlichen Unfallversicherung bei Corporate-Volunteering-Projekten"
"WD6-285/06";"A";"Die Rentenreform 1957; Entstehungsgeschichte, Durchsetzung und Bedeutung damals und heute"
"WD6-290/06";"A";"Auswirkungen des Europarechts auf das kirchliche Arbeitsrecht"
"WD6-291/06";"A";"Sozialwahlen und Selbstverwaltung in der Sozialversicherung mit Ausnahme der gesetzlichen Krankenversicherung und Pflegeversicherung"
"WD6-292/06";"A";"Arbeitgeberzusammenschlüsse (AGZ) - Perspektiven und rechtliche Rahmenbedingungen innovativer betrieblicher Kooperationen"
"WD6-293/06";"A";"Individualisierung sozialer Rechte in Skandinavien im Bereich der Grundsicherung für Arbeitsuchende und der Sozialhilfe"
"WD6-295/06";"A";"Aktienoptionen (Stock Options) als Form  der Mitarbeiterbeteiligung"
"WD7-001/10";"A";"Vereinbarkeit einer altersabhängigen Rabattaktion im Einzelhandel mit dem Allgemeinen Gleichbehandlungsgesetz"
"WD7-003/09";"A";"Substanzanalyse von Drogen (""drug-checking"") - Rechtliche Implikation"
"WD7-004/06";"A";"Zur Verkehrssicherungspflicht für Straßenbäume"
"WD7-004/09";"A";"Haftentschädigung in der Republik Österreich"
"WD7-005/07";"A";"Begründung des Gesetzgebers für die Begrenzung des Unterhaltsvorschusses für Kinder auf die Vollendung des 12. Lebensjahres •"
"WD7-006/06";"A";"Geheimdienstliche Agententätigkeit (§ 99 StGB)"
"WD7-008/08";"A";"Biopatente in der Rinderzüchtung"
"WD7-008/12";"A";"Einsatz und Rechtfertigung der ""stillen SMS"" im Strafprozess- und Polizeirecht"
"WD7-009/06";"A";"Zu den Möglichkeiten der kollektiven Rechtsverfolgung im Rahmen von Verbandsklagen und Musterverfahren"
"WD7-010/06";"A";"Zu den rechtlichen Voraussetzungen einer Stiftung sowie den Begriffen Institut und Akademie"
"WD7-010/09";"A";"Wiedergutmachung für durch Zwangsaussiedlung in der ehemaligen DDR erlittenes Unrecht"
"WD7-011/10";"A";"Die Sicherungsverwahrung im Rechtsvergleich"
"WD7-013/11";"A";"Kostentragung bei der Lärmsanierung an Schienenwegen"
"WD7-014/07";"A";"Einführung einer Hinweispflicht für den Verkauf von Lebensversicherungen"
"WD7-014/09";"A";"Zur Vereinbarkeit einer Senkung des Umsatzsteuersatzes für einzelne Personenfernverkehrsträger mit europäischen Recht"
"WD7-015/08";"A";"Zum Erziehungsgedanken im Jugendstrafrecht"
"WD7-015/09";"A";"""Kulturflatrate"" contra ""Olivennes-Modell"" - Umgang mit . Urheberrechtsverletzungen im Internet in Deutschland, Frankreich und Schweden"
"WD7-018/08";"A";"""Sozialpreise"" in der Energieversorgung"
"WD7-019/07";"A";"Emissionshandel im Luftverkehr"
"WD7-019/12";"A";"Haftungs- und Entschädigungsfragen bei der Einsetzung fehlerhafter Brustimplantate"
"WD7-020/13";"A";"Der notwendige Inhalt des Impressums einer Abgeordnetenhomepage"
"WD7-021/13";"A";"Korruption von Abgeordneten und freies Mandat"
"WD7-023/07";"A";"Rechtsschutz gegen Einfuhr und Verbrennung HCB-haltiger Abfälle"
"WD7-024/06";"A";"Zur Reichweite des Informationsfreiheitsgesetzes bei Petitionen"
"WD7-024/08";"A";"Der Verkauf von Immobilienkrediten an Finanzinvestoren"
"WD7-024/13";"A";"Nachtflugverbote an bestehenden Flughäfen II"
"WD7-025/13";"A";"Festlegung von Flugrouten"
"WD7-026/08";"A";"Vergabepflichtigkeit kommunaler Grundstücksverkäufe sowie Auswirkungen des Vergaberechts auf kommunale Vorhaben in öffentlich-privater Partnerschaft"
"WD7-029/07";"A";"Strafverfahrensrecht in der EU"
"WD7-029/09";"A";"Haftung des Bundes bei Uferschäden durch erhöhten Wellenschlag"
"WD7-030/06";"A";"Rechtlicher Rahmen für die Tätigkeit von in- und ausländischen Nichtregierungsorganisationen in Deutschland"
"WD7-030/07";"A";"Europäische Flora-Fauna-Habitat-Richtlinie und Bundesnaturschutzgesetz"
"WD7-030/09";"A";"Volksverhetzungsdelikte in Deutschland, Spanien, Österreich, Frankreich und der Schweiz"
"WD7-031/06";"AI";"Regelungen im Zusammenhang mit dem Schutz vor Fluglärm"
"WD7-032/09";"A";"Rolle deutscher Kreditinstitute bei Steuerhinterziehung und Steuerflucht"
"WD7-032/11";"A";"Das Umgangsrecht des biologischen Vaters nach dem Urteil des Europäischen Gerichtshofes für Menschenrechte (EGMR) vom 21. Dezember 2010"
"WD7-034/11";"A";"Mindestlohnanforderungen bei der Beschaffung arbeitsmarktpolitischer Leistungen durch die Bundesagentur für Arbeit"
"WD7-035/09";"A";"Die Veröffentlichung von Antwortbriefen von Bundestagsabgeordneten im Internet - Rechtlicher Rahmen und Zulässigkeit -"
"WD7-036/07";"A";"Möglichkeiten der Effektivierung des Gesetzes gegen belästigende Telefonwerbung"
